  **** HLS Build v2024.2 5238294
INFO: [HLS 200-2005] Using work_dir D:/Xillinx_Project/PROJECT/lz4_cmpress/lz4CompressEngineRun 
INFO: [HLS 200-1611] Setting target device to 'xc7z020-clg484-1'
INFO: [HLS 200-1505] Using default flow_target 'vivado'
Resolution: For help on HLS 200-1505 see docs.xilinx.com/access/sources/dita/topic?Doc_Version=2024.2%20English&url=ug1448-hls-guidance&resourceid=200-1505.html
INFO: [HLS 200-1465] Applying ini 'syn.file=D:/Xillinx_Project/PROJECT/data_compression/L1/tests/lz4_compress/lz4_compress_test.cpp' from D:/Xillinx_Project/PROJECT/lz4_cmpress/hls_config.cfg(7)
INFO: [HLS 200-10] Adding design file 'D:/Xillinx_Project/PROJECT/data_compression/L1/tests/lz4_compress/lz4_compress_test.cpp' to the project
INFO: [HLS 200-1465] Applying ini 'syn.file_cflags=D:/Xillinx_Project/PROJECT/data_compression/L1/tests/lz4_compress/lz4_compress_test.cpp,-ID:/Xillinx_Project/PROJECT/data_compression/L1/tests/lz4_compress/../../../L1/include/hw' from D:/Xillinx_Project/PROJECT/lz4_cmpress/hls_config.cfg(8)
INFO: [HLS 200-1465] Applying ini 'tb.file=D:/Xillinx_Project/PROJECT/data_compression/L1/tests/lz4_compress/lz4_compress_test.cpp' from D:/Xillinx_Project/PROJECT/lz4_cmpress/hls_config.cfg(10)
INFO: [HLS 200-10] Adding test bench file 'D:/Xillinx_Project/PROJECT/data_compression/L1/tests/lz4_compress/lz4_compress_test.cpp' to the project
INFO: [HLS 200-1465] Applying ini 'tb.file_cflags=D:/Xillinx_Project/PROJECT/data_compression/L1/tests/lz4_compress/lz4_compress_test.cpp,-ID:/Xillinx_Project/PROJECT/data_compression/L1/tests/lz4_compress/../../../L1/include/hw' from D:/Xillinx_Project/PROJECT/lz4_cmpress/hls_config.cfg(11)
INFO: [HLS 200-1465] Applying ini 'syn.top=lz4CompressEngineRun' from D:/Xillinx_Project/PROJECT/lz4_cmpress/hls_config.cfg(9)
INFO: [HLS 200-1465] Applying ini 'flow_target=vivado' from D:/Xillinx_Project/PROJECT/lz4_cmpress/hls_config.cfg(6)
INFO: [HLS 200-1505] Using flow_target 'vivado'
Resolution: For help on HLS 200-1505 see docs.xilinx.com/access/sources/dita/topic?Doc_Version=2024.2%20English&url=ug1448-hls-guidance&resourceid=200-1505.html
INFO: [HLS 200-1465] Applying ini 'part=xc7z020clg484-1' from D:/Xillinx_Project/PROJECT/lz4_cmpress/hls_config.cfg(1)
INFO: [HLS 200-1465] Applying ini 'clock=7ns' from D:/Xillinx_Project/PROJECT/lz4_cmpress/hls_config.cfg(4)
INFO: [SYN 201-201] Setting up clock 'default' with a period of 7ns.
INFO: [HLS 200-1465] Applying ini 'clock_uncertainty=10%' from D:/Xillinx_Project/PROJECT/lz4_cmpress/hls_config.cfg(5)
INFO: [SYN 201-201] Setting up clock 'default' with an uncertainty of 0.7ns.
INFO: [HLS 200-1465] Applying ini 'cosim.argv=D:/Xillinx_Project/PROJECT/data_compression/L1/tests/lz4_compress/../../../L1/tests/lz4_compress/sample.txt D:/Xillinx_Project/PROJECT/data_compression/L1/tests/lz4_compress/../../../L1/tests/lz4_compress/sample.txt.encoded' from D:/Xillinx_Project/PROJECT/lz4_cmpress/hls_config.cfg(12)
INFO: [HLS 200-1465] Applying ini 'csim.argv=D:/Xillinx_Project/PROJECT/data_compression/L1/tests/lz4_compress/../../../L1/tests/lz4_compress/sample.txt D:/Xillinx_Project/PROJECT/data_compression/L1/tests/lz4_compress/../../../L1/tests/lz4_compress/sample.txt.encoded' from D:/Xillinx_Project/PROJECT/lz4_cmpress/hls_config.cfg(13)
INFO: [HLS 200-1465] Applying ini 'syn.compile.pragma_strict_mode=1' from D:/Xillinx_Project/PROJECT/lz4_cmpress/hls_config.cfg(14)
INFO: [HLS 200-1465] Applying ini 'vivado.flow=syn' from D:/Xillinx_Project/PROJECT/lz4_cmpress/hls_config.cfg(15)
INFO: [HLS 200-1465] Applying ini 'vivado.rtl=verilog' from D:/Xillinx_Project/PROJECT/lz4_cmpress/hls_config.cfg(16)
INFO: [IMPL 213-8] Exporting RTL as a Vivado IP.
WARNING: D:/Xilinx/Vivado/2024.2/tps/win64/jre11.0.16_1 does not exist.

****** Vivado v2024.2 (64-bit)
  **** SW Build 5239630 on Fri Nov 08 22:35:27 MST 2024
  **** IP Build 5239520 on Sun Nov 10 16:12:51 MST 2024
  **** SharedData Build 5239561 on Fri Nov 08 14:39:27 MST 2024
  **** Start of session at: Fri Oct 31 13:42:00 2025
    ** Copyright 1986-2022 Xilinx, Inc. All Rights Reserved.
    ** Copyright 2022-2024 Advanced Micro Devices, Inc. All Rights Reserved.

source run_ippack.tcl -notrace
INFO: calling package_hls_ip ip_types=vitis sysgen json_file=D:/Xillinx_Project/PROJECT/lz4_cmpress/lz4CompressEngineRun/hls/hls_data.json outdir=D:/Xillinx_Project/PROJECT/lz4_cmpress/lz4CompressEngineRun/hls/impl/ip srcdir=D:/Xillinx_Project/PROJECT/lz4_cmpress/lz4CompressEngineRun/hls sort_interfaces_ports=false
INFO: Copied 1 ipmisc file(s) to D:/Xillinx_Project/PROJECT/lz4_cmpress/lz4CompressEngineRun/hls/impl/ip/misc
INFO: Copied 36 verilog file(s) to D:/Xillinx_Project/PROJECT/lz4_cmpress/lz4CompressEngineRun/hls/impl/ip/hdl/verilog
INFO: Copied 33 vhdl file(s) to D:/Xillinx_Project/PROJECT/lz4_cmpress/lz4CompressEngineRun/hls/impl/ip/hdl/vhdl
INFO: Import ports from HDL: D:/Xillinx_Project/PROJECT/lz4_cmpress/lz4CompressEngineRun/hls/impl/ip/hdl/vhdl/lz4CompressEngineRun.vhd (lz4CompressEngineRun)
INFO: Add ap_fifo interface inStream
INFO: [IP_Flow 19-234] Refreshing IP repositories
INFO: [IP_Flow 19-1704] No user IP repositories specified
INFO: [IP_Flow 19-2313] Loaded Vivado IP repository 'D:/Xilinx/Vivado/2024.2/data/ip'.
INFO: Add ap_fifo interface lz4Out
INFO: Add ap_fifo interface lz4Out_eos
INFO: Add ap_fifo interface lz4OutSize
INFO: Add data interface max_lit_limit_address0
INFO: Add data interface max_lit_limit_d0
INFO: Add data interface max_lit_limit_q0
INFO: Add data interface max_lit_limit_address1
INFO: Add data interface max_lit_limit_d1
INFO: Add data interface max_lit_limit_q1
INFO: Add data interface input_size
INFO: Add data interface core_idx
INFO: Add clock interface ap_clk
INFO: Add reset interface ap_rst
INFO: Add ap_ctrl interface ap_ctrl
INFO: Calling post_process_vitis to specialize IP
INFO: Calling post_process_sysgen to specialize IP
Generating sysgen info xml from json file
INFO: Created IP D:/Xillinx_Project/PROJECT/lz4_cmpress/lz4CompressEngineRun/hls/impl/ip/component.xml
INFO: Created IP archive D:/Xillinx_Project/PROJECT/lz4_cmpress/lz4CompressEngineRun/hls/impl/ip/xilinx_com_hls_lz4CompressEngineRun_1_0.zip
INFO: [Common 17-206] Exiting Vivado at Fri Oct 31 13:42:07 2025...
INFO: [IMPL 213-8] Starting RTL evaluation using Vivado ...

D:\Xillinx_Project\PROJECT\lz4_cmpress\lz4CompressEngineRun\hls\impl\verilog>D:/Xilinx/Vivado/2024.2/bin/vivado  -mode batch -source run_vivadosyn.tcl   || exit $? 
WARNING: D:/Xilinx/Vivado/2024.2/tps/win64/jre11.0.16_1 does not exist.

****** Vivado v2024.2 (64-bit)
  **** SW Build 5239630 on Fri Nov 08 22:35:27 MST 2024
  **** IP Build 5239520 on Sun Nov 10 16:12:51 MST 2024
  **** SharedData Build 5239561 on Fri Nov 08 14:39:27 MST 2024
  **** Start of session at: Fri Oct 31 13:42:10 2025
    ** Copyright 1986-2022 Xilinx, Inc. All Rights Reserved.
    ** Copyright 2022-2024 Advanced Micro Devices, Inc. All Rights Reserved.

source run_vivadosyn.tcl
# source ./settings.tcl
## set top_module lz4CompressEngineRun
## set language verilog
## set family zynq
## set device xc7z020
## set package -clg484
## set speed -1
## set clock ap_clk
## set fsm_ext "off"
## set add_io_buffers false 
# source -notrace ./extraction.tcl
# set vivado_proj_name project
# set vivado_proj_dir .
# set target_device "${device}${package}${speed}"
# set target_clk_period_ns "7.000"
# set target_clk_freq_hz [expr {floor(1000 / $target_clk_period_ns) * 1000000}]
# set other_clks_freq_hz {}
# set ip_vlnv xilinx.com:hls:lz4CompressEngineRun:1.0
# set ip_repo_path ../ip
# set bd_design_name bd_0
# set bd_inst_name hls_inst
# set bd_props {}
# set has_synth true
# set synth_design_args {-directive sdx_optimization_effort_high}
# set synth_dcp ""
# set synth_props {}
# set has_impl false
# set impl_props {}
# set report_options [dict create]
# dict set report_options report_level 2
# dict set report_options report_max_paths 10
# dict set report_options stdout_hls_reports 1
# dict set report_options stdout_vivado_reports 0
# dict set report_options hls_project lz4CompressEngineRun
# dict set report_options hls_solution hls
# dict set report_options has_synth $has_synth
# dict set report_options has_impl $has_impl
# dict set report_options vivado_reportbasename $top_module
# dict set report_options vivado_reportdir ./report
# dict set report_options hls_impl_dir ..
# dict set report_options hls_reportdir ../report/$language
# dict set report_options target_clk_period $target_clk_period_ns
# dict set report_options target_device $target_device
# dict set report_options language $language
# dict set report_options clock_name $clock
# dict set report_options error_if_impl_timing_fails false
# dict set report_options topmodule "lz4CompressEngineRun"
# dict set report_options funcmodules {lz4CompressEngineRun_entry_proc lz4CompressEngineRun_lzCompress_6_4_65536_6_1_1024_64_Pipeline_dict_flush lz4CompressEngineRun_lzCompress_6_4_65536_6_1_1024_64_Outline_VITIS_LOOP_84_2 lz4CompressEngineRun_lzCompress_6_4_65536_6_1_1024_64_Pipeline_lz_compress lz4CompressEngineRun_lzCompress_6_4_65536_6_1_1024_64_Pipeline_lz_compress_leftover lz4CompressEngineRun_lzCompress_6_4_65536_6_1_1024_64_Pipeline_lz_left_bytes lz4CompressEngineRun_lzCompress_6_4_65536_6_1_1024_64_s lz4CompressEngineRun_lzBestMatchFilter_6_65536_Pipeline_lz_bestMatchFilter lz4CompressEngineRun_lzBestMatchFilter_6_65536_s lz4CompressEngineRun_lzBooster_255_16384_64_Pipeline_lz_booster lz4CompressEngineRun_lzBooster_255_16384_64_s lz4CompressEngineRun_lz4CompressPart1_4096_8_Pipeline_lz4_divide lz4CompressEngineRun_lz4CompressPart1_4096_8_s lz4CompressEngineRun_lz4CompressPart2_Pipeline_lz4_compress lz4CompressEngineRun_lz4CompressPart2 lz4CompressEngineRun_lz4Compress_4096_8_s}
# dict set report_options bindmodules {lz4CompressEngineRun_flow_control_loop_pipe_sequential_init lz4CompressEngineRun_sparsemux_17_3_408_1_1 lz4CompressEngineRun_sparsemux_11_3_8_1_1 lz4CompressEngineRun_lzCompress_6_4_65536_6_1_1024_64_s_dict_RAM_2P_LUTRAM_1R1W lz4CompressEngineRun_sparsemux_13_3_32_1_1 lz4CompressEngineRun_lzBooster_255_16384_64_s_local_mem_RAM_2P_BRAM_1R1W lz4CompressEngineRun_fifo_w8_d65536_B lz4CompressEngineRun_fifo_w64_d512_B lz4CompressEngineRun_fifo_w32_d2_S lz4CompressEngineRun_start_for_lz4CompressPart2_U0 lz4CompressEngineRun_fifo_w32_d5_S lz4CompressEngineRun_fifo_w32_d8_S lz4CompressEngineRun_fifo_w32_d2_S_x lz4CompressEngineRun_start_for_lz4Compress_4096_8_U0 lz4CompressEngineRun_start_for_lzBestMatchFilter_6_65536_U0 lz4CompressEngineRun_start_for_lzBooster_255_16384_64_U0}
# dict set report_options max_module_depth 8
# create_project $vivado_proj_name $vivado_proj_dir -part $target_device -force
# set_property target_language $language [current_project]
# if { ![file exists $ip_repo_path] } {
#   error "Cannot find packaged HLS IP"
# }
# set_property ip_repo_paths [file normalize $ip_repo_path] [current_project]
# update_ip_catalog
INFO: [IP_Flow 19-234] Refreshing IP repositories
INFO: [IP_Flow 19-1700] Loaded user IP repository 'd:/Xillinx_Project/PROJECT/lz4_cmpress/lz4CompressEngineRun/hls/impl/ip'.
INFO: [IP_Flow 19-2313] Loaded Vivado IP repository 'D:/Xilinx/Vivado/2024.2/data/ip'.
# create_bd_design bd_0
Wrote  : <D:\Xillinx_Project\PROJECT\lz4_cmpress\lz4CompressEngineRun\hls\impl\verilog\project.srcs\sources_1\bd\bd_0\bd_0.bd> 
# set cell_inst [create_bd_cell -type ip -vlnv $ip_vlnv $bd_inst_name]
# if { [llength $bd_props] } { 
#   set_property -dict $bd_props $cell_inst 
# }
# make_bd_pins_external $cell_inst
# make_bd_intf_pins_external $cell_inst
# set bd_clk_ports [get_bd_ports -filter {TYPE==clk}]
# if { $target_clk_freq_hz ne "" } { 
#   foreach bd_clk_port $bd_clk_ports {
#     # Remove "_0" suffix from BD ports & interfaces so they match IP ports 
#     set clk_name [regsub {_0$} [get_property name $bd_clk_port] {}]
#     set port_freq_hz $target_clk_freq_hz
#     if { [dict exists $other_clks_freq_hz $clk_name] } {
#         set port_freq_hz [dict get $other_clks_freq_hz $clk_name]
#     }
#     set_property CONFIG.FREQ_HZ $port_freq_hz $bd_clk_port
#   }
# }
# foreach bd_port [get_bd_intf_ports] {
#   set_property name [regsub {_0$} [get_property name $bd_port] {}] $bd_port
# }
# foreach bd_port [get_bd_ports -filter {INTF!=TRUE}] {
#   set_property name [regsub {_0$} [get_property name $bd_port] {}] $bd_port
# }
# set s_axi_addr_width_min 32
WARNING: [BD 5-233] No interface ports matched 'get_bd_intf_ports -filter {MODE == "Slave" && VLNV =~ "xilinx.com:interface:aximm_rtl:*"}'
# foreach bd_port [get_bd_intf_ports -filter {MODE == "Slave" && VLNV =~ "xilinx.com:interface:aximm_rtl:*"}] {
#   set bd_port_addr_width [get_property CONFIG.ADDR_WIDTH $bd_port]
#   if { $bd_port_addr_width < $s_axi_addr_width_min } {
#     puts "INFO: Updating $bd_port CONFIG.ADDR_WIDTH to $s_axi_addr_width_min"
#     set_property CONFIG.ADDR_WIDTH $s_axi_addr_width_min $bd_port
#   }
# }
# set_msg_config -id {[BD 41-1265]} -severity {CRITICAL WARNING} -new_severity {INFO}
# assign_bd_address
INFO: [BD 41-3093] Triggering Legacy Auto Assign Algorithm
Wrote  : <D:\Xillinx_Project\PROJECT\lz4_cmpress\lz4CompressEngineRun\hls\impl\verilog\project.srcs\sources_1\bd\bd_0\bd_0.bd> 
Verilog Output written to : D:/Xillinx_Project/PROJECT/lz4_cmpress/lz4CompressEngineRun/hls/impl/verilog/project.gen/sources_1/bd/bd_0/synth/bd_0.v
Verilog Output written to : D:/Xillinx_Project/PROJECT/lz4_cmpress/lz4CompressEngineRun/hls/impl/verilog/project.gen/sources_1/bd/bd_0/sim/bd_0.v
Verilog Output written to : D:/Xillinx_Project/PROJECT/lz4_cmpress/lz4CompressEngineRun/hls/impl/verilog/project.gen/sources_1/bd/bd_0/hdl/bd_0_wrapper.v
# set toprtl [make_wrapper -files [get_files ${bd_design_name}.bd] -top]
# add_files -norecurse $toprtl
# set top_inst_name [file root [file tail $toprtl]]
# puts "Using BD top: $top_inst_name"
Using BD top: bd_0_wrapper
# set xdc_files [glob -nocomplain ./*.xdc]
# if { [llength $xdc_files] } {
#     add_files -fileset constrs_1 -norecurse $xdc_files
# }
# launch_runs synth_1 -scripts_only
INFO: [BD 41-1662] The design 'bd_0.bd' is already validated. Therefore parameter propagation will not be re-run.
Verilog Output written to : D:/Xillinx_Project/PROJECT/lz4_cmpress/lz4CompressEngineRun/hls/impl/verilog/project.gen/sources_1/bd/bd_0/synth/bd_0.v
Verilog Output written to : D:/Xillinx_Project/PROJECT/lz4_cmpress/lz4CompressEngineRun/hls/impl/verilog/project.gen/sources_1/bd/bd_0/sim/bd_0.v
Verilog Output written to : D:/Xillinx_Project/PROJECT/lz4_cmpress/lz4CompressEngineRun/hls/impl/verilog/project.gen/sources_1/bd/bd_0/hdl/bd_0_wrapper.v
INFO: [BD 41-1029] Generation completed for the IP Integrator block hls_inst .
Exporting to file D:/Xillinx_Project/PROJECT/lz4_cmpress/lz4CompressEngineRun/hls/impl/verilog/project.gen/sources_1/bd/bd_0/hw_handoff/bd_0.hwh
Generated Hardware Definition File D:/Xillinx_Project/PROJECT/lz4_cmpress/lz4CompressEngineRun/hls/impl/verilog/project.gen/sources_1/bd/bd_0/synth/bd_0.hwdef
INFO: [IP_Flow 19-6924] IPCACHE: Running cache check for IP inst: bd_0_hls_inst_0
WARNING: [Vivado 12-7122] Auto Incremental Compile:: No reference checkpoint was found in run synth_1. Auto-incremental flow will not be run, the standard flow will be run instead.
launch_runs: Time (s): cpu = 00:00:00 ; elapsed = 00:00:06 . Memory (MB): peak = 345.652 ; gain = 0.000
# foreach run [get_runs -filter {IS_SYNTHESIS == 1}] {
#   reset_run [get_runs $run]
# }
# set_property XPM_LIBRARIES {XPM_MEMORY XPM_FIFO} [current_project]
# hls_vivado_reports_setup $report_options
TIMESTAMP: HLS-REPORT: initialize report directories: 2025-10-31 13:42:30 +0800
# if { $has_synth || $has_impl } {
#   # synth properties setting
#   set_property -name {STEPS.SYNTH_DESIGN.ARGS.MORE OPTIONS} -value {-mode out_of_context} -objects [get_runs synth_1]
#   set ip_inst [get_ips -quiet ${bd_design_name}*${bd_inst_name}*]
#   if { ![llength $ip_inst] } {
#       error "Cannot find HLS IP instance: ${bd_design_name}*${bd_inst_name}*"
#   }
#   set synth_run [get_runs -filter {IS_SYNTHESIS == 1} ${ip_inst}*]
#   if { ![llength $synth_run] } {
#       error "Cannot find synth run for HLS IP: ${ip_inst}*"
#   }
# 
#   if { [llength $synth_design_args] } {
#       set_property -name {STEPS.SYNTH_DESIGN.ARGS.MORE OPTIONS} -value $synth_design_args -objects $synth_run
#   }
# 
#   if { [llength $synth_props] } {
#     set_property -dict $synth_props $synth_run
#   }
# 
#   # launch run synth
#   launch_runs synth_1
#   wait_on_run synth_1
#   # synth reports
#   hls_vivado_reports_synth synth_1 $report_options
#   if { $synth_dcp ne "" } {
#     file mkdir [file dirname $synth_dcp]
#     set run_dcp [glob -nocomplain [get_property DIRECTORY $synth_run]/*.dcp]
#     if { [llength $run_dcp] != 1 } { error "Cannot find single dcp file for run $synth_run" }
#     file copy -force $run_dcp $synth_dcp
#   }
# }
INFO: [IP_Flow 19-6924] IPCACHE: Running cache check for IP inst: bd_0_hls_inst_0
WARNING: [Vivado 12-7122] Auto Incremental Compile:: No reference checkpoint was found in run synth_1. Auto-incremental flow will not be run, the standard flow will be run instead.
[Fri Oct 31 13:42:32 2025] Launched bd_0_hls_inst_0_synth_1...
Run output will be captured here: D:/Xillinx_Project/PROJECT/lz4_cmpress/lz4CompressEngineRun/hls/impl/verilog/project.runs/bd_0_hls_inst_0_synth_1/runme.log
[Fri Oct 31 13:42:32 2025] Launched synth_1...
Run output will be captured here: D:/Xillinx_Project/PROJECT/lz4_cmpress/lz4CompressEngineRun/hls/impl/verilog/project.runs/synth_1/runme.log
[Fri Oct 31 13:42:32 2025] Waiting for synth_1 to finish...

WARNING: D:/Xilinx/Vivado/2024.2/tps/win64/jre11.0.16_1 does not exist.

*** Running vivado
    with args -log bd_0_wrapper.vds -m64 -product Vivado -mode batch -messageDb vivado.pb -notrace -source bd_0_wrapper.tcl


WARNING: D:/Xilinx/Vivado/2024.2/tps/win64/jre11.0.16_1 does not exist.

****** Vivado v2024.2 (64-bit)
  **** SW Build 5239630 on Fri Nov 08 22:35:27 MST 2024
  **** IP Build 5239520 on Sun Nov 10 16:12:51 MST 2024
  **** SharedData Build 5239561 on Fri Nov 08 14:39:27 MST 2024
  **** Start of session at: Fri Oct 31 13:44:48 2025
    ** Copyright 1986-2022 Xilinx, Inc. All Rights Reserved.
    ** Copyright 2022-2024 Advanced Micro Devices, Inc. All Rights Reserved.

source bd_0_wrapper.tcl -notrace
INFO: Dispatch client connection id - 53571
INFO: [IP_Flow 19-234] Refreshing IP repositories
INFO: [IP_Flow 19-1700] Loaded user IP repository 'd:/Xillinx_Project/PROJECT/lz4_cmpress/lz4CompressEngineRun/hls/impl/ip'.
INFO: [IP_Flow 19-2313] Loaded Vivado IP repository 'D:/Xilinx/Vivado/2024.2/data/ip'.
WARNING: [IP_Flow 19-4995] The host OS only allows 260 characters in a normal path. The IP cache path is more than 80 characters. If you experience issues with IP caching, please consider changing the IP cache to a location with a shorter path. Alternately consider using the OS subst command to map part of the path to a drive letter. 
Current IP cache path is d:/Xillinx_Project/PROJECT/lz4_cmpress/lz4CompressEngineRun/hls/impl/verilog/project.cache/ip 
Command: synth_design -top bd_0_wrapper -part xc7z020clg484-1 -mode out_of_context
Starting synth_design
Attempting to get a license for feature 'Synthesis' and/or device 'xc7z020'
INFO: [Common 17-349] Got license for feature 'Synthesis' and/or device 'xc7z020'
INFO: [Device 21-403] Loading part xc7z020clg484-1
INFO: [Synth 8-7079] Multithreading enabled for synth_design using a maximum of 2 processes.
INFO: [Synth 8-7078] Launching helper process for spawning children vivado processes
INFO: [Synth 8-7075] Helper process launched with PID 387756
---------------------------------------------------------------------------------
Starting RTL Elaboration : Time (s): cpu = 00:00:03 ; elapsed = 00:00:06 . Memory (MB): peak = 1001.684 ; gain = 467.066
---------------------------------------------------------------------------------
INFO: [Synth 8-6157] synthesizing module 'bd_0_wrapper' [d:/Xillinx_Project/PROJECT/lz4_cmpress/lz4CompressEngineRun/hls/impl/verilog/project.gen/sources_1/bd/bd_0/hdl/bd_0_wrapper.v:13]
INFO: [Synth 8-6157] synthesizing module 'bd_0' [d:/Xillinx_Project/PROJECT/lz4_cmpress/lz4CompressEngineRun/hls/impl/verilog/project.gen/sources_1/bd/bd_0/synth/bd_0.v:13]
INFO: [Synth 8-6157] synthesizing module 'bd_0_hls_inst_0' [D:/Xillinx_Project/PROJECT/lz4_cmpress/lz4CompressEngineRun/hls/impl/verilog/project.runs/synth_1/.Xil/Vivado-391668-TheJackdaw/realtime/bd_0_hls_inst_0_stub.v:6]
INFO: [Synth 8-6155] done synthesizing module 'bd_0_hls_inst_0' (0#1) [D:/Xillinx_Project/PROJECT/lz4_cmpress/lz4CompressEngineRun/hls/impl/verilog/project.runs/synth_1/.Xil/Vivado-391668-TheJackdaw/realtime/bd_0_hls_inst_0_stub.v:6]
INFO: [Synth 8-6155] done synthesizing module 'bd_0' (0#1) [d:/Xillinx_Project/PROJECT/lz4_cmpress/lz4CompressEngineRun/hls/impl/verilog/project.gen/sources_1/bd/bd_0/synth/bd_0.v:13]
INFO: [Synth 8-6155] done synthesizing module 'bd_0_wrapper' (0#1) [d:/Xillinx_Project/PROJECT/lz4_cmpress/lz4CompressEngineRun/hls/impl/verilog/project.gen/sources_1/bd/bd_0/hdl/bd_0_wrapper.v:13]
---------------------------------------------------------------------------------
Finished RTL Elaboration : Time (s): cpu = 00:00:04 ; elapsed = 00:00:07 . Memory (MB): peak = 1112.242 ; gain = 577.625
---------------------------------------------------------------------------------
---------------------------------------------------------------------------------
Start Handling Custom Attributes
---------------------------------------------------------------------------------
---------------------------------------------------------------------------------
Finished Handling Custom Attributes : Time (s): cpu = 00:00:04 ; elapsed = 00:00:08 . Memory (MB): peak = 1112.242 ; gain = 577.625
---------------------------------------------------------------------------------
---------------------------------------------------------------------------------
Finished RTL Optimization Phase 1 : Time (s): cpu = 00:00:04 ; elapsed = 00:00:08 . Memory (MB): peak = 1112.242 ; gain = 577.625
---------------------------------------------------------------------------------
Netlist sorting complete. Time (s): cpu = 00:00:00 ; elapsed = 00:00:00.006 . Memory (MB): peak = 1112.242 ; gain = 0.000
INFO: [Project 1-570] Preparing netlist for logic optimization

Processing XDC Constraints
Initializing timing engine
Parsing XDC File [d:/Xillinx_Project/PROJECT/lz4_cmpress/lz4CompressEngineRun/hls/impl/verilog/project.gen/sources_1/bd/bd_0/ip/bd_0_hls_inst_0/bd_0_hls_inst_0/bd_0_hls_inst_0_in_context.xdc] for cell 'bd_0_i/hls_inst'
Finished Parsing XDC File [d:/Xillinx_Project/PROJECT/lz4_cmpress/lz4CompressEngineRun/hls/impl/verilog/project.gen/sources_1/bd/bd_0/ip/bd_0_hls_inst_0/bd_0_hls_inst_0/bd_0_hls_inst_0_in_context.xdc] for cell 'bd_0_i/hls_inst'
Parsing XDC File [D:/Xillinx_Project/PROJECT/lz4_cmpress/lz4CompressEngineRun/hls/impl/verilog/lz4CompressEngineRun.xdc]
Finished Parsing XDC File [D:/Xillinx_Project/PROJECT/lz4_cmpress/lz4CompressEngineRun/hls/impl/verilog/lz4CompressEngineRun.xdc]
Parsing XDC File [D:/Xillinx_Project/PROJECT/lz4_cmpress/lz4CompressEngineRun/hls/impl/verilog/project.runs/synth_1/dont_touch.xdc]
Finished Parsing XDC File [D:/Xillinx_Project/PROJECT/lz4_cmpress/lz4CompressEngineRun/hls/impl/verilog/project.runs/synth_1/dont_touch.xdc]
Completed Processing XDC Constraints

Netlist sorting complete. Time (s): cpu = 00:00:00 ; elapsed = 00:00:00 . Memory (MB): peak = 1120.129 ; gain = 0.000
INFO: [Project 1-111] Unisim Transformation Summary:
No Unisim elements were transformed.

Constraint Validation Runtime : Time (s): cpu = 00:00:00 ; elapsed = 00:00:00.022 . Memory (MB): peak = 1120.176 ; gain = 0.047
---------------------------------------------------------------------------------
Finished Constraint Validation : Time (s): cpu = 00:00:09 ; elapsed = 00:00:16 . Memory (MB): peak = 1120.176 ; gain = 585.559
---------------------------------------------------------------------------------
---------------------------------------------------------------------------------
Start Loading Part and Timing Information
---------------------------------------------------------------------------------
Loading part: xc7z020clg484-1
---------------------------------------------------------------------------------
Finished Loading Part and Timing Information : Time (s): cpu = 00:00:09 ; elapsed = 00:00:16 . Memory (MB): peak = 1120.176 ; gain = 585.559
---------------------------------------------------------------------------------
---------------------------------------------------------------------------------
Start Applying 'set_property' XDC Constraints
---------------------------------------------------------------------------------
Applied set_property KEEP_HIERARCHY = SOFT for bd_0_i. (constraint file  auto generated constraint).
Applied set_property KEEP_HIERARCHY = SOFT for bd_0_i/hls_inst. (constraint file  auto generated constraint).
---------------------------------------------------------------------------------
Finished applying 'set_property' XDC Constraints : Time (s): cpu = 00:00:09 ; elapsed = 00:00:16 . Memory (MB): peak = 1120.176 ; gain = 585.559
---------------------------------------------------------------------------------
---------------------------------------------------------------------------------
Finished RTL Optimization Phase 2 : Time (s): cpu = 00:00:09 ; elapsed = 00:00:16 . Memory (MB): peak = 1120.176 ; gain = 585.559
---------------------------------------------------------------------------------
---------------------------------------------------------------------------------
Start RTL Component Statistics 
---------------------------------------------------------------------------------
Detailed RTL Component Info : 
---------------------------------------------------------------------------------
Finished RTL Component Statistics 
---------------------------------------------------------------------------------
---------------------------------------------------------------------------------
Start Part Resource Summary
---------------------------------------------------------------------------------
Part Resources:
DSPs: 220 (col length:60)
BRAMs: 280 (col length: RAMB18 60 RAMB36 30)
---------------------------------------------------------------------------------
Finished Part Resource Summary
---------------------------------------------------------------------------------
---------------------------------------------------------------------------------
Start Cross Boundary and Area Optimization
---------------------------------------------------------------------------------
WARNING: [Synth 8-7080] Parallel synthesis criteria is not met
---------------------------------------------------------------------------------
Finished Cross Boundary and Area Optimization : Time (s): cpu = 00:00:10 ; elapsed = 00:00:18 . Memory (MB): peak = 1120.176 ; gain = 585.559
---------------------------------------------------------------------------------
---------------------------------------------------------------------------------
Start Applying XDC Timing Constraints
---------------------------------------------------------------------------------
---------------------------------------------------------------------------------
Finished Applying XDC Timing Constraints : Time (s): cpu = 00:00:14 ; elapsed = 00:00:24 . Memory (MB): peak = 1287.504 ; gain = 752.887
---------------------------------------------------------------------------------
---------------------------------------------------------------------------------
Start Timing Optimization
---------------------------------------------------------------------------------
---------------------------------------------------------------------------------
Finished Timing Optimization : Time (s): cpu = 00:00:14 ; elapsed = 00:00:24 . Memory (MB): peak = 1287.578 ; gain = 752.961
---------------------------------------------------------------------------------
---------------------------------------------------------------------------------
Start Technology Mapping
---------------------------------------------------------------------------------
---------------------------------------------------------------------------------
Finished Technology Mapping : Time (s): cpu = 00:00:14 ; elapsed = 00:00:24 . Memory (MB): peak = 1297.230 ; gain = 762.613
---------------------------------------------------------------------------------
---------------------------------------------------------------------------------
Start IO Insertion
---------------------------------------------------------------------------------
---------------------------------------------------------------------------------
Start Flattening Before IO Insertion
---------------------------------------------------------------------------------
---------------------------------------------------------------------------------
Finished Flattening Before IO Insertion
---------------------------------------------------------------------------------
---------------------------------------------------------------------------------
Start Final Netlist Cleanup
---------------------------------------------------------------------------------
---------------------------------------------------------------------------------
Finished Final Netlist Cleanup
---------------------------------------------------------------------------------
---------------------------------------------------------------------------------
Finished IO Insertion : Time (s): cpu = 00:00:16 ; elapsed = 00:00:28 . Memory (MB): peak = 1514.027 ; gain = 979.410
---------------------------------------------------------------------------------
---------------------------------------------------------------------------------
Start Renaming Generated Instances
---------------------------------------------------------------------------------
---------------------------------------------------------------------------------
Finished Renaming Generated Instances : Time (s): cpu = 00:00:16 ; elapsed = 00:00:28 . Memory (MB): peak = 1514.027 ; gain = 979.410
---------------------------------------------------------------------------------
---------------------------------------------------------------------------------
Start Rebuilding User Hierarchy
---------------------------------------------------------------------------------
---------------------------------------------------------------------------------
Finished Rebuilding User Hierarchy : Time (s): cpu = 00:00:16 ; elapsed = 00:00:28 . Memory (MB): peak = 1514.027 ; gain = 979.410
---------------------------------------------------------------------------------
---------------------------------------------------------------------------------
Start Renaming Generated Ports
---------------------------------------------------------------------------------
---------------------------------------------------------------------------------
Finished Renaming Generated Ports : Time (s): cpu = 00:00:16 ; elapsed = 00:00:28 . Memory (MB): peak = 1514.027 ; gain = 979.410
---------------------------------------------------------------------------------
---------------------------------------------------------------------------------
Start Handling Custom Attributes
---------------------------------------------------------------------------------
---------------------------------------------------------------------------------
Finished Handling Custom Attributes : Time (s): cpu = 00:00:16 ; elapsed = 00:00:28 . Memory (MB): peak = 1514.027 ; gain = 979.410
---------------------------------------------------------------------------------
---------------------------------------------------------------------------------
Start Renaming Generated Nets
---------------------------------------------------------------------------------
---------------------------------------------------------------------------------
Finished Renaming Generated Nets : Time (s): cpu = 00:00:16 ; elapsed = 00:00:28 . Memory (MB): peak = 1514.027 ; gain = 979.410
---------------------------------------------------------------------------------
---------------------------------------------------------------------------------
Start Writing Synthesis Report
---------------------------------------------------------------------------------

Report BlackBoxes: 
+------+----------------+----------+
|      |BlackBox name   |Instances |
+------+----------------+----------+
|1     |bd_0_hls_inst_0 |         1|
+------+----------------+----------+

Report Cell Usage: 
+------+--------------+------+
|      |Cell          |Count |
+------+--------------+------+
|1     |bd_0_hls_inst |     1|
+------+--------------+------+
---------------------------------------------------------------------------------
Finished Writing Synthesis Report : Time (s): cpu = 00:00:16 ; elapsed = 00:00:28 . Memory (MB): peak = 1514.027 ; gain = 979.410
---------------------------------------------------------------------------------
Synthesis finished with 0 errors, 0 critical warnings and 1 warnings.
Synthesis Optimization Runtime : Time (s): cpu = 00:00:11 ; elapsed = 00:00:26 . Memory (MB): peak = 1514.027 ; gain = 971.477
Synthesis Optimization Complete : Time (s): cpu = 00:00:17 ; elapsed = 00:00:28 . Memory (MB): peak = 1514.027 ; gain = 979.410
INFO: [Project 1-571] Translating synthesized netlist
Netlist sorting complete. Time (s): cpu = 00:00:00 ; elapsed = 00:00:00.005 . Memory (MB): peak = 1514.027 ; gain = 0.000
INFO: [Project 1-570] Preparing netlist for logic optimization
INFO: [Opt 31-138] Pushed 0 inverter(s) to 0 load pin(s).
Netlist sorting complete. Time (s): cpu = 00:00:00 ; elapsed = 00:00:00 . Memory (MB): peak = 1526.840 ; gain = 0.000
INFO: [Project 1-111] Unisim Transformation Summary:
No Unisim elements were transformed.

Synth Design complete | Checksum: 8d11fd4a
INFO: [Common 17-83] Releasing license: Synthesis
21 Infos, 2 Warnings, 0 Critical Warnings and 0 Errors encountered.
synth_design completed successfully
synth_design: Time (s): cpu = 00:00:20 ; elapsed = 00:00:37 . Memory (MB): peak = 1526.840 ; gain = 1230.227
INFO: [Common 17-1381] The checkpoint 'D:/Xillinx_Project/PROJECT/lz4_cmpress/lz4CompressEngineRun/hls/impl/verilog/project.runs/synth_1/bd_0_wrapper.dcp' has been generated.
INFO: [Vivado 12-24828] Executing command : report_utilization -file bd_0_wrapper_utilization_synth.rpt -pb bd_0_wrapper_utilization_synth.pb
INFO: [Common 17-206] Exiting Vivado at Fri Oct 31 13:45:31 2025...
[Fri Oct 31 13:45:35 2025] synth_1 finished
wait_on_runs: Time (s): cpu = 00:00:00 ; elapsed = 00:03:04 . Memory (MB): peak = 345.652 ; gain = 0.000
TIMESTAMP: HLS-REPORT: synthesis open_run: 2025-10-31 13:45:35 +0800
INFO: HLS-REPORT: Opening synthesis design database: open_run synth_1
Design is defaulting to impl run constrset: constrs_1
Design is defaulting to synth run part: xc7z020clg484-1
INFO: [Device 21-403] Loading part xc7z020clg484-1
INFO: [Project 1-454] Reading design checkpoint 'd:/Xillinx_Project/PROJECT/lz4_cmpress/lz4CompressEngineRun/hls/impl/verilog/project.gen/sources_1/bd/bd_0/ip/bd_0_hls_inst_0/bd_0_hls_inst_0.dcp' for cell 'bd_0_i/hls_inst'
Netlist sorting complete. Time (s): cpu = 00:00:00 ; elapsed = 00:00:00.165 . Memory (MB): peak = 613.129 ; gain = 0.000
INFO: [Netlist 29-17] Analyzing 2929 Unisim elements for replacement
INFO: [Netlist 29-28] Unisim Transformation completed in 0 CPU seconds
INFO: [Project 1-479] Netlist was created with Vivado 2024.2
INFO: [Project 1-570] Preparing netlist for logic optimization
Parsing XDC File [D:/Xillinx_Project/PROJECT/lz4_cmpress/lz4CompressEngineRun/hls/impl/verilog/lz4CompressEngineRun.xdc]
Finished Parsing XDC File [D:/Xillinx_Project/PROJECT/lz4_cmpress/lz4CompressEngineRun/hls/impl/verilog/lz4CompressEngineRun.xdc]
INFO: [Opt 31-138] Pushed 0 inverter(s) to 0 load pin(s).
Netlist sorting complete. Time (s): cpu = 00:00:00 ; elapsed = 00:00:00.012 . Memory (MB): peak = 798.105 ; gain = 0.000
INFO: [Project 1-111] Unisim Transformation Summary:
  A total of 2176 instances were transformed.
  RAM64M => RAM64M (RAMD64E(x4)): 2176 instances

open_run: Time (s): cpu = 00:00:04 ; elapsed = 00:00:09 . Memory (MB): peak = 798.105 ; gain = 452.453
TIMESTAMP: HLS-REPORT: synthesis generate_reports_vivado: 2025-10-31 13:45:44 +0800
INFO: HLS-REPORT: Running report: report_utilization -file ./report/lz4CompressEngineRun_utilization_synth.rpt
INFO: HLS-REPORT: Running report: report_utilization -hierarchical -hierarchical_depth 8 -file ./report/lz4CompressEngineRun_utilization_hierarchical_synth.rpt
INFO: HLS-REPORT: Running report: report_timing_summary -file ./report/lz4CompressEngineRun_timing_synth.rpt
INFO: [Timing 38-35] Done setting XDC timing constraints.
INFO: [Timing 38-91] UpdateTimingParams: Speed grade: -1, Delay Type: min_max.
INFO: [Timing 38-191] Multithreading enabled for timing update using a maximum of 2 CPUs
WARNING: [Timing 38-242] The property HD.CLK_SRC of clock port "ap_clk" is not set. In out-of-context mode, this prevents timing estimation for clock delay/skew
Resolution: Set the HD.CLK_SRC property of the out-of-context port to the location of the clock buffer instance in the top-level design
report_timing_summary: Time (s): cpu = 00:00:05 ; elapsed = 00:00:08 . Memory (MB): peak = 1411.477 ; gain = 613.371
INFO: HLS-REPORT: Running report: report_power -file ./report/lz4CompressEngineRun_power_synth.rpt -xpe ./lz4CompressEngineRun_power.xpe
Command: report_power -file ./report/lz4CompressEngineRun_power_synth.rpt -xpe ./lz4CompressEngineRun_power.xpe
Running Vector-less Activity Propagation...

Finished Running Vector-less Activity Propagation
12 Infos, 2 Warnings, 0 Critical Warnings and 0 Errors encountered.
report_power completed successfully
INFO: HLS-REPORT: Running report: report_timing -max_paths 10 -file ./report/lz4CompressEngineRun_timing_paths_synth.rpt
INFO: [Timing 38-91] UpdateTimingParams: Speed grade: -1, Delay Type: max.
INFO: [Timing 38-191] Multithreading enabled for timing update using a maximum of 2 CPUs
INFO: [Timing 38-78] ReportTimingParams: -max_paths 10 -nworst 1 -delay_type max -sort_by slack.
INFO: HLS-REPORT: Running report: report_design_analysis -file ./report/lz4CompressEngineRun_design_analysis_synth.rpt
INFO: [Implflow 30-839]  
INFO: HLS-REPORT: Running report: ::tclapp::xilinx::designutils::report_failfast -detailed_report synth -file ./report/lz4CompressEngineRun_failfast_synth.rpt
 -I- design metrics completed in 1 seconds
 -I- DONT_TOUCH metric completed in 0 seconds
 -I- MARK_DEBUG metric completed in 1 seconds
 -I- utilization metrics completed in 0 seconds
 -I- control set metrics completed in 1 seconds
 -I- methodology check metrics completed in 2 seconds
 -I- average fanout metrics completed in 3 seconds (0 modules)
 -I- non-FD high fanout nets completed in 1 seconds
 -I- path budgeting metrics completed in 1 seconds
#  +-----------------------------------------------------------------------------------------+
#  | Design Summary                                                                          |
#  | design_1                                                                                |
#  | xc7z020clg484-1                                                                         |
#  +-----------------------------------------------------------+-----------+--------+--------+
#  | Criteria                                                  | Guideline | Actual | Status |
#  +-----------------------------------------------------------+-----------+--------+--------+
#  | LUT                                                       | 70%       | 27.00% | OK     |
#  | FD                                                        | 50%       | 6.44%  | OK     |
#  | LUTRAM+SRL                                                | 25%       | 50.53% | REVIEW |
#  | MUXF7                                                     | 15%       | 1.53%  | OK     |
#  | DSP                                                       | 80%       | 0.00%  | OK     |
#  | RAMB/FIFO                                                 | 80%       | 15.00% | OK     |
#  | DSP+RAMB+URAM (Avg)                                       | 70%       | 15.00% | OK     |
#  | BUFGCE* + BUFGCTRL                                        | 24        | 0      | OK     |
#  | DONT_TOUCH (cells/nets)                                   | 0         | 0      | OK     |
#  | MARK_DEBUG (nets)                                         | 0         | 0      | OK     |
#  | Control Sets                                              | 998       | 113    | OK     |
#  | Average Fanout for modules > 100k cells                   | 4         | 4.95   | REVIEW |
#  | Max Average Fanout for modules > 100k cells               | 4         | 0      | OK     |
#  | Non-FD high fanout nets > 10k loads                       | 0         | 0      | OK     |
#  +-----------------------------------------------------------+-----------+--------+--------+
#  | TIMING-6 (No common primary clock between related clocks) | 0         | 0      | OK     |
#  | TIMING-7 (No common node between related clocks)          | 0         | 0      | OK     |
#  | TIMING-8 (No common period between related clocks)        | 0         | 0      | OK     |
#  | TIMING-14 (LUT on the clock tree)                         | 0         | 0      | OK     |
#  | TIMING-35 (No common node in paths with the same clock)   | 0         | 0      | OK     |
#  +-----------------------------------------------------------+-----------+--------+--------+
#  | Number of paths above max LUT budgeting (0.575ns)         | 0         | 0      | OK     |
#  | Number of paths above max Net budgeting (0.403ns)         | 0         | 0      | OK     |
#  +-----------------------------------------------------------+-----------+--------+--------+
 -I- Generated file D:/Xillinx_Project/PROJECT/lz4_cmpress/lz4CompressEngineRun/hls/impl/verilog/report/lz4CompressEngineRun_failfast_synth.rpt
 -I- Number of criteria to review: 2
 -I- This report should be run before placing the design and uses conservative guidelines beyond which runtime and timing closure will likely be more challenging
 -I- report_failfast completed in 10 seconds
TIMESTAMP: HLS-REPORT: synthesis gen_data_dict_vivado: 2025-10-31 13:46:07 +0800
TIMESTAMP: HLS-REPORT: synth extract_util_hier: 2025-10-31 13:46:07 +0800
TIMESTAMP: HLS-REPORT: synth get_cell_hier_data: 2025-10-31 13:46:07 +0800
TIMESTAMP: HLS-REPORT: synth get_timing_paths: 2025-10-31 13:46:07 +0800
TIMESTAMP: HLS-REPORT: synth process timing paths: 2025-10-31 13:46:07 +0800
TIMESTAMP: HLS-REPORT: synth get_all_vv_rpt_files: 2025-10-31 13:46:07 +0800
TIMESTAMP: HLS-REPORT: synthesis write_reports_vivado: 2025-10-31 13:46:07 +0800
HLS EXTRACTION: synth area_totals:  0 53200 106400 220 280 0 0
HLS EXTRACTION: synth area_current: 0 14362 6854 0 42 0 89 0 0 0
HLS EXTRACTION: synth resources_dict: AVAIL_LUT 53200 LUT 14362 AVAIL_FF 106400 FF 6854 AVAIL_DSP 220 DSP 0 AVAIL_BRAM 280 BRAM 42 AVAIL_URAM 0 URAM 0 LATCH 0 SRL 89 AVAIL_CLB 0 CLB 0
INFO: HLS-REPORT: generated D:/Xillinx_Project/PROJECT/lz4_cmpress/lz4CompressEngineRun/hls/impl/verilog/report/vivado_syn.xml
INFO: HLS-REPORT: generated D:/Xillinx_Project/PROJECT/lz4_cmpress/lz4CompressEngineRun/hls/impl/report/verilog/lz4CompressEngineRun_export.rpt


Implementation tool: Xilinx Vivado v.2024.2
Project:             lz4CompressEngineRun
Solution:            hls
Device target:       xc7z020-clg484-1
Report date:         Fri Oct 31 13:46:08 +0800 2025

#=== Post-Synthesis Resource usage ===
SLICE:            0
LUT:          14362
FF:            6854
DSP:              0
BRAM:            42
URAM:             0
LATCH:            0
SRL:             89
CLB:              0

#=== Final timing ===
CP required:                     7.000
CP achieved post-synthesis:      6.510
Timing met

TIMESTAMP: HLS-REPORT: synthesis end: 2025-10-31 13:46:08 +0800
# if { $has_impl } {
#   # launch run impl
#   if { [llength $impl_props] } {
#     set_property -dict $impl_props [get_runs impl_1]
#   }
#   launch_runs impl_1
#   wait_on_run impl_1
#   # impl reports
#   hls_vivado_reports_impl impl_1 $report_options
# }
# hls_vivado_reports_finalize $report_options
TIMESTAMP: HLS-REPORT: all reports complete: 2025-10-31 13:46:08 +0800
INFO: [Common 17-206] Exiting Vivado at Fri Oct 31 13:46:08 2025...
INFO: [HLS 200-802] Generated output file lz4CompressEngineRun/lz4CompressEngineRun.zip
INFO: [HLS 200-112] Total CPU user time: 1 seconds. Total CPU system time: 1 seconds. Total elapsed time: 258.033 seconds; peak allocated memory: 329.598 MB.
INFO: [vitis-run 60-791] Total elapsed time: 0h 4m 23s
