  **** HLS Build v2024.2 5238294
INFO: [HLS 200-2005] Using work_dir D:/Xillinx_Project/PROJECT/cholesky_test/kernel_cholesky_0 
INFO: [HLS 200-1611] Setting target device to 'xc7z020-clg484-1'
INFO: [HLS 200-1505] Using default flow_target 'vivado'
Resolution: For help on HLS 200-1505 see docs.xilinx.com/access/sources/dita/topic?Doc_Version=2024.2%20English&url=ug1448-hls-guidance&resourceid=200-1505.html
WARNING: [HLS 200-1998] cannot find relative file path '../../host' in directory(s): D:/Xillinx_Project/PROJECT/cholesky_test
INFO: [HLS 200-1465] Applying ini 'syn.file=D:/Xillinx_Project/PROJECT/solver/L1/tests/cholesky/kernel/kernel_cholesky_0.cpp' from D:/Xillinx_Project/PROJECT/cholesky_test/hls_config.cfg(7)
INFO: [HLS 200-10] Adding design file 'D:/Xillinx_Project/PROJECT/solver/L1/tests/cholesky/kernel/kernel_cholesky_0.cpp' to the project
INFO: [HLS 200-1465] Applying ini 'syn.file_cflags=D:/Xillinx_Project/PROJECT/solver/L1/tests/cholesky/kernel/kernel_cholesky_0.cpp,-DMATRIX_DIM=3 -DMATRIX_LOWER_TRIANGULAR=0 -DSEL_ARCH=0 -D_DATA_PATH=D:/Xillinx_Project/PROJECT/solver/L1/tests/cholesky/complex_fixed_arch0/../../../../L1/tests/cholesky/datas/. -ID:/Xillinx_Project/PROJECT/solver/L1/tests/cholesky/complex_fixed_arch0 -ID:/Xillinx_Project/PROJECT/solver/L1/tests/cholesky/complex_fixed_arch0/../../../../L1/tests/cholesky/host/. -ID:/Xillinx_Project/PROJECT/solver/L1/tests/cholesky/complex_fixed_arch0/../../../../L1/tests/cholesky/kernel/. -ID:/Xillinx_Project/PROJECT/solver/L1/tests/cholesky/complex_fixed_arch0/../../../../L1/tests/cholesky/. -ID:/Xillinx_Project/PROJECT/solver/L1/tests/cholesky/complex_fixed_arch0/../../../../L1/tests/. -ID:/Xillinx_Project/PROJECT/solver/L1/tests/cholesky/complex_fixed_arch0/../../../../L1/include/. -ID:/Xillinx_Project/PROJECT/solver/L1/tests/cholesky/complex_fixed_arch0/../../../../L1/include/hw -ID:/Xillinx_Project/PROJECT/solver/L1/tests/cholesky/complex_fixed_arch0/../../../../L2/include -ID:/Xillinx_Project/PROJECT/solver/L1/tests/cholesky/complex_fixed_arch0/../../../../../utils/L1/include/.' from D:/Xillinx_Project/PROJECT/cholesky_test/hls_config.cfg(8)
INFO: [HLS 200-1465] Applying ini 'tb.file=D:/Xillinx_Project/PROJECT/solver/L1/tests/cholesky/host/test_cholesky.cpp' from D:/Xillinx_Project/PROJECT/cholesky_test/hls_config.cfg(10)
INFO: [HLS 200-10] Adding test bench file 'D:/Xillinx_Project/PROJECT/solver/L1/tests/cholesky/host/test_cholesky.cpp' to the project
INFO: [HLS 200-1465] Applying ini 'tb.file_cflags=D:/Xillinx_Project/PROJECT/solver/L1/tests/cholesky/host/test_cholesky.cpp,-DMATRIX_DIM=3 -DMATRIX_LOWER_TRIANGULAR=0 -DSEL_ARCH=0 -D_DATA_PATH=D:/Xillinx_Project/PROJECT/solver/L1/tests/cholesky/complex_fixed_arch0/../../../../L1/tests/cholesky/datas/. -ID:/Xillinx_Project/PROJECT/solver/L1/tests/cholesky/complex_fixed_arch0 -ID:/Xillinx_Project/PROJECT/solver/L1/tests/cholesky/complex_fixed_arch0/../../../../L1/tests/cholesky/host/. -ID:/Xillinx_Project/PROJECT/solver/L1/tests/cholesky/complex_fixed_arch0/../../../../L1/tests/cholesky/kernel/. -ID:/Xillinx_Project/PROJECT/solver/L1/tests/cholesky/complex_fixed_arch0/../../../../L1/tests/cholesky/. -ID:/Xillinx_Project/PROJECT/solver/L1/tests/cholesky/complex_fixed_arch0/../../../../L1/tests/. -ID:/Xillinx_Project/PROJECT/solver/L1/tests/cholesky/complex_fixed_arch0/../../../../L1/include/. -ID:/Xillinx_Project/PROJECT/solver/L1/tests/cholesky/complex_fixed_arch0/../../../../L1/include/hw -I../../host -ID:/Xillinx_Project/PROJECT/solver/L1/tests/cholesky/complex_fixed_arch0/../../../../../utils/L1/include/.' from D:/Xillinx_Project/PROJECT/cholesky_test/hls_config.cfg(11)
INFO: [HLS 200-1465] Applying ini 'syn.top=kernel_cholesky_0' from D:/Xillinx_Project/PROJECT/cholesky_test/hls_config.cfg(9)
INFO: [HLS 200-1465] Applying ini 'flow_target=vivado' from D:/Xillinx_Project/PROJECT/cholesky_test/hls_config.cfg(6)
INFO: [HLS 200-1505] Using flow_target 'vivado'
Resolution: For help on HLS 200-1505 see docs.xilinx.com/access/sources/dita/topic?Doc_Version=2024.2%20English&url=ug1448-hls-guidance&resourceid=200-1505.html
INFO: [HLS 200-1465] Applying ini 'part=xc7z020clg484-1' from D:/Xillinx_Project/PROJECT/cholesky_test/hls_config.cfg(1)
INFO: [HLS 200-1465] Applying ini 'clock=6ns' from D:/Xillinx_Project/PROJECT/cholesky_test/hls_config.cfg(4)
INFO: [SYN 201-201] Setting up clock 'default' with a period of 6ns.
INFO: [HLS 200-1465] Applying ini 'clock_uncertainty=10%' from D:/Xillinx_Project/PROJECT/cholesky_test/hls_config.cfg(5)
INFO: [SYN 201-201] Setting up clock 'default' with an uncertainty of 0.6ns.
INFO: [HLS 200-1465] Applying ini 'vivado.flow=syn' from D:/Xillinx_Project/PROJECT/cholesky_test/hls_config.cfg(12)
INFO: [HLS 200-1465] Applying ini 'vivado.rtl=verilog' from D:/Xillinx_Project/PROJECT/cholesky_test/hls_config.cfg(13)
INFO: [IMPL 213-8] Exporting RTL as a Vivado IP.
WARNING: D:/Xilinx/Vivado/2024.2/tps/win64/jre11.0.16_1 does not exist.

****** Vivado v2024.2 (64-bit)
  **** SW Build 5239630 on Fri Nov 08 22:35:27 MST 2024
  **** IP Build 5239520 on Sun Nov 10 16:12:51 MST 2024
  **** SharedData Build 5239561 on Fri Nov 08 14:39:27 MST 2024
  **** Start of session at: Sat Nov  1 13:17:38 2025
    ** Copyright 1986-2022 Xilinx, Inc. All Rights Reserved.
    ** Copyright 2022-2024 Advanced Micro Devices, Inc. All Rights Reserved.

source run_ippack.tcl -notrace
INFO: calling package_hls_ip ip_types=vitis sysgen json_file=D:/Xillinx_Project/PROJECT/cholesky_test/kernel_cholesky_0/hls/hls_data.json outdir=D:/Xillinx_Project/PROJECT/cholesky_test/kernel_cholesky_0/hls/impl/ip srcdir=D:/Xillinx_Project/PROJECT/cholesky_test/kernel_cholesky_0/hls sort_interfaces_ports=false
INFO: Copied 1 ipmisc file(s) to D:/Xillinx_Project/PROJECT/cholesky_test/kernel_cholesky_0/hls/impl/ip/misc
INFO: Copied 25 verilog file(s) to D:/Xillinx_Project/PROJECT/cholesky_test/kernel_cholesky_0/hls/impl/ip/hdl/verilog
INFO: Copied 25 vhdl file(s) to D:/Xillinx_Project/PROJECT/cholesky_test/kernel_cholesky_0/hls/impl/ip/hdl/vhdl
Generating 1 subcores in D:/Xillinx_Project/PROJECT/cholesky_test/kernel_cholesky_0/hls/impl/ip/hdl/ip.tmp:
impl/misc/kernel_cholesky_0_dsqrt_64ns_64ns_64_57_no_dsp_1_ip.tcl
INFO: [ProjectBase 1-489] The host OS only allows 260 characters in a normal path. The project is stored in a path with more than 80 characters. If you experience issues with IP, Block Designs, or files not being found, please consider moving the project to a location with a shorter path. Alternately consider using the OS subst command to map part of the path to a drive letter.
Current project path is 'D:/Xillinx_Project/PROJECT/cholesky_test/kernel_cholesky_0/hls/impl/ip/hdl/ip.tmp'
INFO: Using COE_DIR=D:/Xillinx_Project/PROJECT/cholesky_test/kernel_cholesky_0/hls/impl/ip/hdl/verilog
INFO: Generating kernel_cholesky_0_dsqrt_64ns_64ns_64_57_no_dsp_1_ip via file impl/misc/kernel_cholesky_0_dsqrt_64ns_64ns_64_57_no_dsp_1_ip.tcl
INFO: [IP_Flow 19-234] Refreshing IP repositories
INFO: [IP_Flow 19-1704] No user IP repositories specified
INFO: [IP_Flow 19-2313] Loaded Vivado IP repository 'D:/Xilinx/Vivado/2024.2/data/ip'.
WARNING: [IP_Flow 19-4832] The IP name 'kernel_cholesky_0_dsqrt_64ns_64ns_64_57_no_dsp_1_ip' you have specified is long. The Windows operating system has path length limitations. It is recommended you use shorter names to reduce the likelihood of issues.
INFO: [IP_Flow 19-1686] Generating 'Synthesis' target for IP 'kernel_cholesky_0_dsqrt_64ns_64ns_64_57_no_dsp_1_ip'...
INFO: [IP_Flow 19-1686] Generating 'Simulation' target for IP 'kernel_cholesky_0_dsqrt_64ns_64ns_64_57_no_dsp_1_ip'...
INFO: Done generating kernel_cholesky_0_dsqrt_64ns_64ns_64_57_no_dsp_1_ip via file impl/misc/kernel_cholesky_0_dsqrt_64ns_64ns_64_57_no_dsp_1_ip.tcl
INFO: Import ports from HDL: D:/Xillinx_Project/PROJECT/cholesky_test/kernel_cholesky_0/hls/impl/ip/hdl/vhdl/kernel_cholesky_0.vhd (kernel_cholesky_0)
INFO: Add clock interface ap_clk
INFO: Add reset interface ap_rst
INFO: Add ap_ctrl interface ap_ctrl
INFO: Add data interface ap_return
INFO: [IP_Flow 19-234] Refreshing IP repositories
INFO: [IP_Flow 19-1704] No user IP repositories specified
INFO: [IP_Flow 19-2313] Loaded Vivado IP repository 'D:/Xilinx/Vivado/2024.2/data/ip'.
INFO: Add ap_fifo interface matrixAStrm
INFO: Add ap_fifo interface matrixLStrm
INFO: Calling post_process_vitis to specialize IP
INFO: Calling post_process_sysgen to specialize IP
Generating sysgen info xml from json file
INFO: Created IP D:/Xillinx_Project/PROJECT/cholesky_test/kernel_cholesky_0/hls/impl/ip/component.xml
INFO: Created IP archive D:/Xillinx_Project/PROJECT/cholesky_test/kernel_cholesky_0/hls/impl/ip/xilinx_com_hls_kernel_cholesky_0_1_0.zip
INFO: [Common 17-206] Exiting Vivado at Sat Nov  1 13:17:46 2025...
INFO: [IMPL 213-8] Starting RTL evaluation using Vivado ...

D:\Xillinx_Project\PROJECT\cholesky_test\kernel_cholesky_0\hls\impl\verilog>D:/Xilinx/Vivado/2024.2/bin/vivado  -mode batch -source run_vivadosyn.tcl   || exit $? 
WARNING: D:/Xilinx/Vivado/2024.2/tps/win64/jre11.0.16_1 does not exist.

****** Vivado v2024.2 (64-bit)
  **** SW Build 5239630 on Fri Nov 08 22:35:27 MST 2024
  **** IP Build 5239520 on Sun Nov 10 16:12:51 MST 2024
  **** SharedData Build 5239561 on Fri Nov 08 14:39:27 MST 2024
  **** Start of session at: Sat Nov  1 13:17:49 2025
    ** Copyright 1986-2022 Xilinx, Inc. All Rights Reserved.
    ** Copyright 2022-2024 Advanced Micro Devices, Inc. All Rights Reserved.

source run_vivadosyn.tcl
# source ./settings.tcl
## set top_module kernel_cholesky_0
## set language verilog
## set family zynq
## set device xc7z020
## set package -clg484
## set speed -1
## set clock ap_clk
## set fsm_ext "off"
## set add_io_buffers false 
# source -notrace ./extraction.tcl
# set vivado_proj_name project
# set vivado_proj_dir .
# set target_device "${device}${package}${speed}"
# set target_clk_period_ns "6.000"
# set target_clk_freq_hz [expr {floor(1000 / $target_clk_period_ns) * 1000000}]
# set other_clks_freq_hz {}
# set ip_vlnv xilinx.com:hls:kernel_cholesky_0:1.0
# set ip_repo_path ../ip
# set bd_design_name bd_0
# set bd_inst_name hls_inst
# set bd_props {}
# set has_synth true
# set synth_design_args {-directive sdx_optimization_effort_high}
# set synth_dcp ""
# set synth_props {}
# set has_impl false
# set impl_props {}
# set report_options [dict create]
# dict set report_options report_level 2
# dict set report_options report_max_paths 10
# dict set report_options stdout_hls_reports 1
# dict set report_options stdout_vivado_reports 0
# dict set report_options hls_project kernel_cholesky_0
# dict set report_options hls_solution hls
# dict set report_options has_synth $has_synth
# dict set report_options has_impl $has_impl
# dict set report_options vivado_reportbasename $top_module
# dict set report_options vivado_reportdir ./report
# dict set report_options hls_impl_dir ..
# dict set report_options hls_reportdir ../report/$language
# dict set report_options target_clk_period $target_clk_period_ns
# dict set report_options target_device $target_device
# dict set report_options language $language
# dict set report_options clock_name $clock
# dict set report_options error_if_impl_timing_fails false
# dict set report_options topmodule "kernel_cholesky_0"
# dict set report_options funcmodules {kernel_cholesky_0_kernel_cholesky_0_Pipeline_VITIS_LOOP_722_1 kernel_cholesky_0_choleskyAlt_false_3_choleskyTraits_x_complex_x_complex_ap_fixed_Pipeline_sum_s kernel_cholesky_0_x_sqrt_17_2_4_0_0_s kernel_cholesky_0_x_sqrt_34_2_4_0_0_s kernel_cholesky_0_choleskyAlt_false_3_choleskyTraits_x_complex_x_complex_ap_fixed_s kernel_cholesky_0_kernel_cholesky_0_Pipeline_VITIS_LOOP_732_3}
# dict set report_options bindmodules {kernel_cholesky_0_flow_control_loop_pipe_sequential_init kernel_cholesky_0_sparsemux_7_2_16_1_1 kernel_cholesky_0_mul_16s_16s_32_2_1 kernel_cholesky_0_ctlz_17_17_1_1 kernel_cholesky_0_bitselect_1ns_54ns_32s_1_1_1 kernel_cholesky_0_sparsemux_7_2_17_1_1 kernel_cholesky_0_sparsemux_7_2_1_1_1 kernel_cholesky_0_sparsemux_9_3_17_1_1 kernel_cholesky_0_ctlz_34_34_1_1 kernel_cholesky_0_sparsemux_7_2_34_1_1 kernel_cholesky_0_sparsemux_9_3_34_1_1 kernel_cholesky_0_mul_34s_33s_67_3_1 kernel_cholesky_0_mul_2s_2s_3_1_1 kernel_cholesky_0_mul_2s_2s_2_1_1 kernel_cholesky_0_sdiv_34ns_19s_34_38_seq_1 kernel_cholesky_0_dsqrt_64ns_64ns_64_57_no_dsp_1 kernel_cholesky_0_A_re_RAM_AUTO_1R1W kernel_cholesky_0_L_re_RAM_AUTO_1R1W}
# dict set report_options max_module_depth 7
# create_project $vivado_proj_name $vivado_proj_dir -part $target_device -force
# set_property target_language $language [current_project]
# if { ![file exists $ip_repo_path] } {
#   error "Cannot find packaged HLS IP"
# }
# set_property ip_repo_paths [file normalize $ip_repo_path] [current_project]
# update_ip_catalog
INFO: [IP_Flow 19-234] Refreshing IP repositories
INFO: [IP_Flow 19-1700] Loaded user IP repository 'd:/Xillinx_Project/PROJECT/cholesky_test/kernel_cholesky_0/hls/impl/ip'.
INFO: [IP_Flow 19-2313] Loaded Vivado IP repository 'D:/Xilinx/Vivado/2024.2/data/ip'.
# create_bd_design bd_0
Wrote  : <D:\Xillinx_Project\PROJECT\cholesky_test\kernel_cholesky_0\hls\impl\verilog\project.srcs\sources_1\bd\bd_0\bd_0.bd> 
# set cell_inst [create_bd_cell -type ip -vlnv $ip_vlnv $bd_inst_name]
# if { [llength $bd_props] } { 
#   set_property -dict $bd_props $cell_inst 
# }
# make_bd_pins_external $cell_inst
# make_bd_intf_pins_external $cell_inst
# set bd_clk_ports [get_bd_ports -filter {TYPE==clk}]
# if { $target_clk_freq_hz ne "" } { 
#   foreach bd_clk_port $bd_clk_ports {
#     # Remove "_0" suffix from BD ports & interfaces so they match IP ports 
#     set clk_name [regsub {_0$} [get_property name $bd_clk_port] {}]
#     set port_freq_hz $target_clk_freq_hz
#     if { [dict exists $other_clks_freq_hz $clk_name] } {
#         set port_freq_hz [dict get $other_clks_freq_hz $clk_name]
#     }
#     set_property CONFIG.FREQ_HZ $port_freq_hz $bd_clk_port
#   }
# }
# foreach bd_port [get_bd_intf_ports] {
#   set_property name [regsub {_0$} [get_property name $bd_port] {}] $bd_port
# }
# foreach bd_port [get_bd_ports -filter {INTF!=TRUE}] {
#   set_property name [regsub {_0$} [get_property name $bd_port] {}] $bd_port
# }
# set s_axi_addr_width_min 32
WARNING: [BD 5-233] No interface ports matched 'get_bd_intf_ports -filter {MODE == "Slave" && VLNV =~ "xilinx.com:interface:aximm_rtl:*"}'
# foreach bd_port [get_bd_intf_ports -filter {MODE == "Slave" && VLNV =~ "xilinx.com:interface:aximm_rtl:*"}] {
#   set bd_port_addr_width [get_property CONFIG.ADDR_WIDTH $bd_port]
#   if { $bd_port_addr_width < $s_axi_addr_width_min } {
#     puts "INFO: Updating $bd_port CONFIG.ADDR_WIDTH to $s_axi_addr_width_min"
#     set_property CONFIG.ADDR_WIDTH $s_axi_addr_width_min $bd_port
#   }
# }
# set_msg_config -id {[BD 41-1265]} -severity {CRITICAL WARNING} -new_severity {INFO}
# assign_bd_address
INFO: [BD 41-3093] Triggering Legacy Auto Assign Algorithm
Wrote  : <D:\Xillinx_Project\PROJECT\cholesky_test\kernel_cholesky_0\hls\impl\verilog\project.srcs\sources_1\bd\bd_0\bd_0.bd> 
Verilog Output written to : D:/Xillinx_Project/PROJECT/cholesky_test/kernel_cholesky_0/hls/impl/verilog/project.gen/sources_1/bd/bd_0/synth/bd_0.v
Verilog Output written to : D:/Xillinx_Project/PROJECT/cholesky_test/kernel_cholesky_0/hls/impl/verilog/project.gen/sources_1/bd/bd_0/sim/bd_0.v
Verilog Output written to : D:/Xillinx_Project/PROJECT/cholesky_test/kernel_cholesky_0/hls/impl/verilog/project.gen/sources_1/bd/bd_0/hdl/bd_0_wrapper.v
# set toprtl [make_wrapper -files [get_files ${bd_design_name}.bd] -top]
# add_files -norecurse $toprtl
# set top_inst_name [file root [file tail $toprtl]]
# puts "Using BD top: $top_inst_name"
Using BD top: bd_0_wrapper
# set xdc_files [glob -nocomplain ./*.xdc]
# if { [llength $xdc_files] } {
#     add_files -fileset constrs_1 -norecurse $xdc_files
# }
# launch_runs synth_1 -scripts_only
INFO: [BD 41-1662] The design 'bd_0.bd' is already validated. Therefore parameter propagation will not be re-run.
Verilog Output written to : D:/Xillinx_Project/PROJECT/cholesky_test/kernel_cholesky_0/hls/impl/verilog/project.gen/sources_1/bd/bd_0/synth/bd_0.v
Verilog Output written to : D:/Xillinx_Project/PROJECT/cholesky_test/kernel_cholesky_0/hls/impl/verilog/project.gen/sources_1/bd/bd_0/sim/bd_0.v
Verilog Output written to : D:/Xillinx_Project/PROJECT/cholesky_test/kernel_cholesky_0/hls/impl/verilog/project.gen/sources_1/bd/bd_0/hdl/bd_0_wrapper.v
INFO: [BD 41-1029] Generation completed for the IP Integrator block hls_inst .
Exporting to file D:/Xillinx_Project/PROJECT/cholesky_test/kernel_cholesky_0/hls/impl/verilog/project.gen/sources_1/bd/bd_0/hw_handoff/bd_0.hwh
Generated Hardware Definition File D:/Xillinx_Project/PROJECT/cholesky_test/kernel_cholesky_0/hls/impl/verilog/project.gen/sources_1/bd/bd_0/synth/bd_0.hwdef
INFO: [IP_Flow 19-6924] IPCACHE: Running cache check for IP inst: bd_0_hls_inst_0
WARNING: [Vivado 12-7122] Auto Incremental Compile:: No reference checkpoint was found in run synth_1. Auto-incremental flow will not be run, the standard flow will be run instead.
launch_runs: Time (s): cpu = 00:00:00 ; elapsed = 00:00:06 . Memory (MB): peak = 347.180 ; gain = 0.000
# foreach run [get_runs -filter {IS_SYNTHESIS == 1}] {
#   reset_run [get_runs $run]
# }
# set_property XPM_LIBRARIES {XPM_MEMORY XPM_FIFO} [current_project]
# hls_vivado_reports_setup $report_options
TIMESTAMP: HLS-REPORT: initialize report directories: 2025-11-01 13:18:05 +0800
# if { $has_synth || $has_impl } {
#   # synth properties setting
#   set_property -name {STEPS.SYNTH_DESIGN.ARGS.MORE OPTIONS} -value {-mode out_of_context} -objects [get_runs synth_1]
#   set ip_inst [get_ips -quiet ${bd_design_name}*${bd_inst_name}*]
#   if { ![llength $ip_inst] } {
#       error "Cannot find HLS IP instance: ${bd_design_name}*${bd_inst_name}*"
#   }
#   set synth_run [get_runs -filter {IS_SYNTHESIS == 1} ${ip_inst}*]
#   if { ![llength $synth_run] } {
#       error "Cannot find synth run for HLS IP: ${ip_inst}*"
#   }
# 
#   if { [llength $synth_design_args] } {
#       set_property -name {STEPS.SYNTH_DESIGN.ARGS.MORE OPTIONS} -value $synth_design_args -objects $synth_run
#   }
# 
#   if { [llength $synth_props] } {
#     set_property -dict $synth_props $synth_run
#   }
# 
#   # launch run synth
#   launch_runs synth_1
#   wait_on_run synth_1
#   # synth reports
#   hls_vivado_reports_synth synth_1 $report_options
#   if { $synth_dcp ne "" } {
#     file mkdir [file dirname $synth_dcp]
#     set run_dcp [glob -nocomplain [get_property DIRECTORY $synth_run]/*.dcp]
#     if { [llength $run_dcp] != 1 } { error "Cannot find single dcp file for run $synth_run" }
#     file copy -force $run_dcp $synth_dcp
#   }
# }
INFO: [IP_Flow 19-6924] IPCACHE: Running cache check for IP inst: bd_0_hls_inst_0
WARNING: [Vivado 12-7122] Auto Incremental Compile:: No reference checkpoint was found in run synth_1. Auto-incremental flow will not be run, the standard flow will be run instead.
[Sat Nov  1 13:18:07 2025] Launched bd_0_hls_inst_0_synth_1...
Run output will be captured here: D:/Xillinx_Project/PROJECT/cholesky_test/kernel_cholesky_0/hls/impl/verilog/project.runs/bd_0_hls_inst_0_synth_1/runme.log
[Sat Nov  1 13:18:07 2025] Launched synth_1...
Run output will be captured here: D:/Xillinx_Project/PROJECT/cholesky_test/kernel_cholesky_0/hls/impl/verilog/project.runs/synth_1/runme.log
[Sat Nov  1 13:18:07 2025] Waiting for synth_1 to finish...

WARNING: D:/Xilinx/Vivado/2024.2/tps/win64/jre11.0.16_1 does not exist.

*** Running vivado
    with args -log bd_0_wrapper.vds -m64 -product Vivado -mode batch -messageDb vivado.pb -notrace -source bd_0_wrapper.tcl


WARNING: D:/Xilinx/Vivado/2024.2/tps/win64/jre11.0.16_1 does not exist.

****** Vivado v2024.2 (64-bit)
  **** SW Build 5239630 on Fri Nov 08 22:35:27 MST 2024
  **** IP Build 5239520 on Sun Nov 10 16:12:51 MST 2024
  **** SharedData Build 5239561 on Fri Nov 08 14:39:27 MST 2024
  **** Start of session at: Sat Nov  1 13:20:44 2025
    ** Copyright 1986-2022 Xilinx, Inc. All Rights Reserved.
    ** Copyright 2022-2024 Advanced Micro Devices, Inc. All Rights Reserved.

source bd_0_wrapper.tcl -notrace
INFO: Dispatch client connection id - 53775
INFO: [IP_Flow 19-234] Refreshing IP repositories
INFO: [IP_Flow 19-1700] Loaded user IP repository 'd:/Xillinx_Project/PROJECT/cholesky_test/kernel_cholesky_0/hls/impl/ip'.
INFO: [IP_Flow 19-2313] Loaded Vivado IP repository 'D:/Xilinx/Vivado/2024.2/data/ip'.
WARNING: [IP_Flow 19-4995] The host OS only allows 260 characters in a normal path. The IP cache path is more than 80 characters. If you experience issues with IP caching, please consider changing the IP cache to a location with a shorter path. Alternately consider using the OS subst command to map part of the path to a drive letter. 
Current IP cache path is d:/Xillinx_Project/PROJECT/cholesky_test/kernel_cholesky_0/hls/impl/verilog/project.cache/ip 
Command: synth_design -top bd_0_wrapper -part xc7z020clg484-1 -mode out_of_context
Starting synth_design
Attempting to get a license for feature 'Synthesis' and/or device 'xc7z020'
INFO: [Common 17-349] Got license for feature 'Synthesis' and/or device 'xc7z020'
INFO: [Device 21-403] Loading part xc7z020clg484-1
INFO: [Synth 8-7079] Multithreading enabled for synth_design using a maximum of 2 processes.
INFO: [Synth 8-7078] Launching helper process for spawning children vivado processes
INFO: [Synth 8-7075] Helper process launched with PID 41644
---------------------------------------------------------------------------------
Starting RTL Elaboration : Time (s): cpu = 00:00:03 ; elapsed = 00:00:05 . Memory (MB): peak = 1002.004 ; gain = 467.777
---------------------------------------------------------------------------------
INFO: [Synth 8-6157] synthesizing module 'bd_0_wrapper' [d:/Xillinx_Project/PROJECT/cholesky_test/kernel_cholesky_0/hls/impl/verilog/project.gen/sources_1/bd/bd_0/hdl/bd_0_wrapper.v:13]
INFO: [Synth 8-6157] synthesizing module 'bd_0' [d:/Xillinx_Project/PROJECT/cholesky_test/kernel_cholesky_0/hls/impl/verilog/project.gen/sources_1/bd/bd_0/synth/bd_0.v:13]
INFO: [Synth 8-6157] synthesizing module 'bd_0_hls_inst_0' [D:/Xillinx_Project/PROJECT/cholesky_test/kernel_cholesky_0/hls/impl/verilog/project.runs/synth_1/.Xil/Vivado-34080-TheJackdaw/realtime/bd_0_hls_inst_0_stub.v:6]
INFO: [Synth 8-6155] done synthesizing module 'bd_0_hls_inst_0' (0#1) [D:/Xillinx_Project/PROJECT/cholesky_test/kernel_cholesky_0/hls/impl/verilog/project.runs/synth_1/.Xil/Vivado-34080-TheJackdaw/realtime/bd_0_hls_inst_0_stub.v:6]
INFO: [Synth 8-6155] done synthesizing module 'bd_0' (0#1) [d:/Xillinx_Project/PROJECT/cholesky_test/kernel_cholesky_0/hls/impl/verilog/project.gen/sources_1/bd/bd_0/synth/bd_0.v:13]
INFO: [Synth 8-6155] done synthesizing module 'bd_0_wrapper' (0#1) [d:/Xillinx_Project/PROJECT/cholesky_test/kernel_cholesky_0/hls/impl/verilog/project.gen/sources_1/bd/bd_0/hdl/bd_0_wrapper.v:13]
---------------------------------------------------------------------------------
Finished RTL Elaboration : Time (s): cpu = 00:00:04 ; elapsed = 00:00:07 . Memory (MB): peak = 1112.781 ; gain = 578.555
---------------------------------------------------------------------------------
---------------------------------------------------------------------------------
Start Handling Custom Attributes
---------------------------------------------------------------------------------
---------------------------------------------------------------------------------
Finished Handling Custom Attributes : Time (s): cpu = 00:00:04 ; elapsed = 00:00:07 . Memory (MB): peak = 1112.781 ; gain = 578.555
---------------------------------------------------------------------------------
---------------------------------------------------------------------------------
Finished RTL Optimization Phase 1 : Time (s): cpu = 00:00:04 ; elapsed = 00:00:07 . Memory (MB): peak = 1112.781 ; gain = 578.555
---------------------------------------------------------------------------------
Netlist sorting complete. Time (s): cpu = 00:00:00 ; elapsed = 00:00:00.002 . Memory (MB): peak = 1112.781 ; gain = 0.000
INFO: [Project 1-570] Preparing netlist for logic optimization

Processing XDC Constraints
Initializing timing engine
Parsing XDC File [d:/Xillinx_Project/PROJECT/cholesky_test/kernel_cholesky_0/hls/impl/verilog/project.gen/sources_1/bd/bd_0/ip/bd_0_hls_inst_0/bd_0_hls_inst_0/bd_0_hls_inst_0_in_context.xdc] for cell 'bd_0_i/hls_inst'
Finished Parsing XDC File [d:/Xillinx_Project/PROJECT/cholesky_test/kernel_cholesky_0/hls/impl/verilog/project.gen/sources_1/bd/bd_0/ip/bd_0_hls_inst_0/bd_0_hls_inst_0/bd_0_hls_inst_0_in_context.xdc] for cell 'bd_0_i/hls_inst'
Parsing XDC File [D:/Xillinx_Project/PROJECT/cholesky_test/kernel_cholesky_0/hls/impl/verilog/kernel_cholesky_0.xdc]
Finished Parsing XDC File [D:/Xillinx_Project/PROJECT/cholesky_test/kernel_cholesky_0/hls/impl/verilog/kernel_cholesky_0.xdc]
Parsing XDC File [D:/Xillinx_Project/PROJECT/cholesky_test/kernel_cholesky_0/hls/impl/verilog/project.runs/synth_1/dont_touch.xdc]
Finished Parsing XDC File [D:/Xillinx_Project/PROJECT/cholesky_test/kernel_cholesky_0/hls/impl/verilog/project.runs/synth_1/dont_touch.xdc]
Completed Processing XDC Constraints

Netlist sorting complete. Time (s): cpu = 00:00:00 ; elapsed = 00:00:00 . Memory (MB): peak = 1122.789 ; gain = 0.000
INFO: [Project 1-111] Unisim Transformation Summary:
No Unisim elements were transformed.

Constraint Validation Runtime : Time (s): cpu = 00:00:00 ; elapsed = 00:00:00.020 . Memory (MB): peak = 1123.426 ; gain = 0.637
---------------------------------------------------------------------------------
Finished Constraint Validation : Time (s): cpu = 00:00:08 ; elapsed = 00:00:14 . Memory (MB): peak = 1123.426 ; gain = 589.199
---------------------------------------------------------------------------------
---------------------------------------------------------------------------------
Start Loading Part and Timing Information
---------------------------------------------------------------------------------
Loading part: xc7z020clg484-1
---------------------------------------------------------------------------------
Finished Loading Part and Timing Information : Time (s): cpu = 00:00:08 ; elapsed = 00:00:14 . Memory (MB): peak = 1123.426 ; gain = 589.199
---------------------------------------------------------------------------------
---------------------------------------------------------------------------------
Start Applying 'set_property' XDC Constraints
---------------------------------------------------------------------------------
Applied set_property KEEP_HIERARCHY = SOFT for bd_0_i. (constraint file  auto generated constraint).
Applied set_property KEEP_HIERARCHY = SOFT for bd_0_i/hls_inst. (constraint file  auto generated constraint).
---------------------------------------------------------------------------------
Finished applying 'set_property' XDC Constraints : Time (s): cpu = 00:00:08 ; elapsed = 00:00:14 . Memory (MB): peak = 1123.426 ; gain = 589.199
---------------------------------------------------------------------------------
---------------------------------------------------------------------------------
Finished RTL Optimization Phase 2 : Time (s): cpu = 00:00:08 ; elapsed = 00:00:14 . Memory (MB): peak = 1123.426 ; gain = 589.199
---------------------------------------------------------------------------------
---------------------------------------------------------------------------------
Start RTL Component Statistics 
---------------------------------------------------------------------------------
Detailed RTL Component Info : 
---------------------------------------------------------------------------------
Finished RTL Component Statistics 
---------------------------------------------------------------------------------
---------------------------------------------------------------------------------
Start Part Resource Summary
---------------------------------------------------------------------------------
Part Resources:
DSPs: 220 (col length:60)
BRAMs: 280 (col length: RAMB18 60 RAMB36 30)
---------------------------------------------------------------------------------
Finished Part Resource Summary
---------------------------------------------------------------------------------
---------------------------------------------------------------------------------
Start Cross Boundary and Area Optimization
---------------------------------------------------------------------------------
WARNING: [Synth 8-7080] Parallel synthesis criteria is not met
---------------------------------------------------------------------------------
Finished Cross Boundary and Area Optimization : Time (s): cpu = 00:00:10 ; elapsed = 00:00:16 . Memory (MB): peak = 1123.426 ; gain = 589.199
---------------------------------------------------------------------------------
---------------------------------------------------------------------------------
Start Applying XDC Timing Constraints
---------------------------------------------------------------------------------
---------------------------------------------------------------------------------
Finished Applying XDC Timing Constraints : Time (s): cpu = 00:00:13 ; elapsed = 00:00:20 . Memory (MB): peak = 1281.402 ; gain = 747.176
---------------------------------------------------------------------------------
---------------------------------------------------------------------------------
Start Timing Optimization
---------------------------------------------------------------------------------
---------------------------------------------------------------------------------
Finished Timing Optimization : Time (s): cpu = 00:00:13 ; elapsed = 00:00:20 . Memory (MB): peak = 1281.402 ; gain = 747.176
---------------------------------------------------------------------------------
---------------------------------------------------------------------------------
Start Technology Mapping
---------------------------------------------------------------------------------
---------------------------------------------------------------------------------
Finished Technology Mapping : Time (s): cpu = 00:00:13 ; elapsed = 00:00:20 . Memory (MB): peak = 1290.992 ; gain = 756.766
---------------------------------------------------------------------------------
---------------------------------------------------------------------------------
Start IO Insertion
---------------------------------------------------------------------------------
---------------------------------------------------------------------------------
Start Flattening Before IO Insertion
---------------------------------------------------------------------------------
---------------------------------------------------------------------------------
Finished Flattening Before IO Insertion
---------------------------------------------------------------------------------
---------------------------------------------------------------------------------
Start Final Netlist Cleanup
---------------------------------------------------------------------------------
---------------------------------------------------------------------------------
Finished Final Netlist Cleanup
---------------------------------------------------------------------------------
---------------------------------------------------------------------------------
Finished IO Insertion : Time (s): cpu = 00:00:15 ; elapsed = 00:00:23 . Memory (MB): peak = 1507.840 ; gain = 973.613
---------------------------------------------------------------------------------
---------------------------------------------------------------------------------
Start Renaming Generated Instances
---------------------------------------------------------------------------------
---------------------------------------------------------------------------------
Finished Renaming Generated Instances : Time (s): cpu = 00:00:15 ; elapsed = 00:00:23 . Memory (MB): peak = 1507.840 ; gain = 973.613
---------------------------------------------------------------------------------
---------------------------------------------------------------------------------
Start Rebuilding User Hierarchy
---------------------------------------------------------------------------------
---------------------------------------------------------------------------------
Finished Rebuilding User Hierarchy : Time (s): cpu = 00:00:15 ; elapsed = 00:00:23 . Memory (MB): peak = 1507.840 ; gain = 973.613
---------------------------------------------------------------------------------
---------------------------------------------------------------------------------
Start Renaming Generated Ports
---------------------------------------------------------------------------------
---------------------------------------------------------------------------------
Finished Renaming Generated Ports : Time (s): cpu = 00:00:15 ; elapsed = 00:00:23 . Memory (MB): peak = 1507.840 ; gain = 973.613
---------------------------------------------------------------------------------
---------------------------------------------------------------------------------
Start Handling Custom Attributes
---------------------------------------------------------------------------------
---------------------------------------------------------------------------------
Finished Handling Custom Attributes : Time (s): cpu = 00:00:15 ; elapsed = 00:00:23 . Memory (MB): peak = 1507.840 ; gain = 973.613
---------------------------------------------------------------------------------
---------------------------------------------------------------------------------
Start Renaming Generated Nets
---------------------------------------------------------------------------------
---------------------------------------------------------------------------------
Finished Renaming Generated Nets : Time (s): cpu = 00:00:15 ; elapsed = 00:00:23 . Memory (MB): peak = 1507.840 ; gain = 973.613
---------------------------------------------------------------------------------
---------------------------------------------------------------------------------
Start Writing Synthesis Report
---------------------------------------------------------------------------------

Report BlackBoxes: 
+------+----------------+----------+
|      |BlackBox name   |Instances |
+------+----------------+----------+
|1     |bd_0_hls_inst_0 |         1|
+------+----------------+----------+

Report Cell Usage: 
+------+--------------+------+
|      |Cell          |Count |
+------+--------------+------+
|1     |bd_0_hls_inst |     1|
+------+--------------+------+
---------------------------------------------------------------------------------
Finished Writing Synthesis Report : Time (s): cpu = 00:00:15 ; elapsed = 00:00:23 . Memory (MB): peak = 1507.840 ; gain = 973.613
---------------------------------------------------------------------------------
Synthesis finished with 0 errors, 0 critical warnings and 1 warnings.
Synthesis Optimization Runtime : Time (s): cpu = 00:00:10 ; elapsed = 00:00:22 . Memory (MB): peak = 1507.840 ; gain = 962.969
Synthesis Optimization Complete : Time (s): cpu = 00:00:15 ; elapsed = 00:00:24 . Memory (MB): peak = 1507.840 ; gain = 973.613
INFO: [Project 1-571] Translating synthesized netlist
Netlist sorting complete. Time (s): cpu = 00:00:00 ; elapsed = 00:00:00.001 . Memory (MB): peak = 1507.840 ; gain = 0.000
INFO: [Project 1-570] Preparing netlist for logic optimization
INFO: [Opt 31-138] Pushed 0 inverter(s) to 0 load pin(s).
Netlist sorting complete. Time (s): cpu = 00:00:00 ; elapsed = 00:00:00 . Memory (MB): peak = 1507.840 ; gain = 0.000
INFO: [Project 1-111] Unisim Transformation Summary:
No Unisim elements were transformed.

Synth Design complete | Checksum: f5fbff7e
INFO: [Common 17-83] Releasing license: Synthesis
21 Infos, 2 Warnings, 0 Critical Warnings and 0 Errors encountered.
synth_design completed successfully
synth_design: Time (s): cpu = 00:00:17 ; elapsed = 00:00:31 . Memory (MB): peak = 1507.840 ; gain = 1211.652
INFO: [Common 17-1381] The checkpoint 'D:/Xillinx_Project/PROJECT/cholesky_test/kernel_cholesky_0/hls/impl/verilog/project.runs/synth_1/bd_0_wrapper.dcp' has been generated.
INFO: [Vivado 12-24828] Executing command : report_utilization -file bd_0_wrapper_utilization_synth.rpt -pb bd_0_wrapper_utilization_synth.pb
INFO: [Common 17-206] Exiting Vivado at Sat Nov  1 13:21:21 2025...
[Sat Nov  1 13:21:26 2025] synth_1 finished
wait_on_runs: Time (s): cpu = 00:00:00 ; elapsed = 00:03:19 . Memory (MB): peak = 347.180 ; gain = 0.000
TIMESTAMP: HLS-REPORT: synthesis open_run: 2025-11-01 13:21:26 +0800
INFO: HLS-REPORT: Opening synthesis design database: open_run synth_1
Design is defaulting to impl run constrset: constrs_1
Design is defaulting to synth run part: xc7z020clg484-1
INFO: [Device 21-403] Loading part xc7z020clg484-1
INFO: [Project 1-454] Reading design checkpoint 'd:/Xillinx_Project/PROJECT/cholesky_test/kernel_cholesky_0/hls/impl/verilog/project.gen/sources_1/bd/bd_0/ip/bd_0_hls_inst_0/bd_0_hls_inst_0.dcp' for cell 'bd_0_i/hls_inst'
Netlist sorting complete. Time (s): cpu = 00:00:00 ; elapsed = 00:00:00.162 . Memory (MB): peak = 605.754 ; gain = 0.000
INFO: [Netlist 29-17] Analyzing 819 Unisim elements for replacement
INFO: [Netlist 29-28] Unisim Transformation completed in 0 CPU seconds
INFO: [Project 1-479] Netlist was created with Vivado 2024.2
INFO: [Project 1-570] Preparing netlist for logic optimization
Parsing XDC File [D:/Xillinx_Project/PROJECT/cholesky_test/kernel_cholesky_0/hls/impl/verilog/kernel_cholesky_0.xdc]
Finished Parsing XDC File [D:/Xillinx_Project/PROJECT/cholesky_test/kernel_cholesky_0/hls/impl/verilog/kernel_cholesky_0.xdc]
INFO: [Opt 31-138] Pushed 0 inverter(s) to 0 load pin(s).
Netlist sorting complete. Time (s): cpu = 00:00:00 ; elapsed = 00:00:00.005 . Memory (MB): peak = 760.980 ; gain = 0.000
INFO: [Project 1-111] Unisim Transformation Summary:
  A total of 32 instances were transformed.
  RAM16X1S => RAM32X1S (RAMS32): 32 instances

open_run: Time (s): cpu = 00:00:04 ; elapsed = 00:00:05 . Memory (MB): peak = 760.980 ; gain = 413.801
TIMESTAMP: HLS-REPORT: synthesis generate_reports_vivado: 2025-11-01 13:21:31 +0800
INFO: HLS-REPORT: Running report: report_utilization -file ./report/kernel_cholesky_0_utilization_synth.rpt
INFO: HLS-REPORT: Running report: report_utilization -hierarchical -hierarchical_depth 7 -file ./report/kernel_cholesky_0_utilization_hierarchical_synth.rpt
INFO: HLS-REPORT: Running report: report_timing_summary -file ./report/kernel_cholesky_0_timing_synth.rpt
INFO: [Timing 38-35] Done setting XDC timing constraints.
INFO: [Timing 38-91] UpdateTimingParams: Speed grade: -1, Delay Type: min_max.
INFO: [Timing 38-191] Multithreading enabled for timing update using a maximum of 2 CPUs
WARNING: [Timing 38-242] The property HD.CLK_SRC of clock port "ap_clk" is not set. In out-of-context mode, this prevents timing estimation for clock delay/skew
Resolution: Set the HD.CLK_SRC property of the out-of-context port to the location of the clock buffer instance in the top-level design
report_timing_summary: Time (s): cpu = 00:00:04 ; elapsed = 00:00:06 . Memory (MB): peak = 1335.223 ; gain = 574.242
INFO: HLS-REPORT: Running report: report_power -file ./report/kernel_cholesky_0_power_synth.rpt -xpe ./kernel_cholesky_0_power.xpe
Command: report_power -file ./report/kernel_cholesky_0_power_synth.rpt -xpe ./kernel_cholesky_0_power.xpe
Running Vector-less Activity Propagation...

Finished Running Vector-less Activity Propagation
12 Infos, 2 Warnings, 0 Critical Warnings and 0 Errors encountered.
report_power completed successfully
INFO: HLS-REPORT: Running report: report_timing -max_paths 10 -file ./report/kernel_cholesky_0_timing_paths_synth.rpt
INFO: [Timing 38-91] UpdateTimingParams: Speed grade: -1, Delay Type: max.
INFO: [Timing 38-191] Multithreading enabled for timing update using a maximum of 2 CPUs
INFO: [Timing 38-78] ReportTimingParams: -max_paths 10 -nworst 1 -delay_type max -sort_by slack.
INFO: HLS-REPORT: Running report: report_design_analysis -file ./report/kernel_cholesky_0_design_analysis_synth.rpt
INFO: [Implflow 30-839]  
INFO: HLS-REPORT: Running report: ::tclapp::xilinx::designutils::report_failfast -detailed_report synth -file ./report/kernel_cholesky_0_failfast_synth.rpt
 -I- design metrics completed in 0 seconds
 -I- DONT_TOUCH metric completed in 0 seconds
 -I- MARK_DEBUG metric completed in 0 seconds
 -I- utilization metrics completed in 1 seconds
 -I- control set metrics completed in 0 seconds
 -I- methodology check metrics completed in 0 seconds
 -I- average fanout metrics completed in 1 seconds (0 modules)
 -I- non-FD high fanout nets completed in 1 seconds
 -I- path budgeting metrics completed in 1 seconds
#  +-----------------------------------------------------------------------------------------+
#  | Design Summary                                                                          |
#  | design_1                                                                                |
#  | xc7z020clg484-1                                                                         |
#  +-----------------------------------------------------------+-----------+--------+--------+
#  | Criteria                                                  | Guideline | Actual | Status |
#  +-----------------------------------------------------------+-----------+--------+--------+
#  | LUT                                                       | 70%       | 8.90%  | OK     |
#  | FD                                                        | 50%       | 6.02%  | OK     |
#  | LUTRAM+SRL                                                | 25%       | 0.55%  | OK     |
#  | MUXF7                                                     | 15%       | 0.12%  | OK     |
#  | DSP                                                       | 80%       | 6.36%  | OK     |
#  | RAMB/FIFO                                                 | 80%       | 0.71%  | OK     |
#  | DSP+RAMB+URAM (Avg)                                       | 70%       | 3.54%  | OK     |
#  | BUFGCE* + BUFGCTRL                                        | 24        | 0      | OK     |
#  | DONT_TOUCH (cells/nets)                                   | 0         | 0      | OK     |
#  | MARK_DEBUG (nets)                                         | 0         | 0      | OK     |
#  | Control Sets                                              | 998       | 82     | OK     |
#  | Average Fanout for modules > 100k cells                   | 4         | 2.28   | OK     |
#  | Max Average Fanout for modules > 100k cells               | 4         | 0      | OK     |
#  | Non-FD high fanout nets > 10k loads                       | 0         | 0      | OK     |
#  +-----------------------------------------------------------+-----------+--------+--------+
#  | TIMING-6 (No common primary clock between related clocks) | 0         | 0      | OK     |
#  | TIMING-7 (No common node between related clocks)          | 0         | 0      | OK     |
#  | TIMING-8 (No common period between related clocks)        | 0         | 0      | OK     |
#  | TIMING-14 (LUT on the clock tree)                         | 0         | 0      | OK     |
#  | TIMING-35 (No common node in paths with the same clock)   | 0         | 0      | OK     |
#  +-----------------------------------------------------------+-----------+--------+--------+
#  | Number of paths above max LUT budgeting (0.575ns)         | 0         | 0      | OK     |
#  | Number of paths above max Net budgeting (0.403ns)         | 0         | 0      | OK     |
#  +-----------------------------------------------------------+-----------+--------+--------+
 -I- Generated file D:/Xillinx_Project/PROJECT/cholesky_test/kernel_cholesky_0/hls/impl/verilog/report/kernel_cholesky_0_failfast_synth.rpt
 -I- Number of criteria to review: 0
 -I- This report should be run before placing the design and uses conservative guidelines beyond which runtime and timing closure will likely be more challenging
 -I- report_failfast completed in 4 seconds
TIMESTAMP: HLS-REPORT: synthesis gen_data_dict_vivado: 2025-11-01 13:21:43 +0800
TIMESTAMP: HLS-REPORT: synth extract_util_hier: 2025-11-01 13:21:43 +0800
TIMESTAMP: HLS-REPORT: synth get_cell_hier_data: 2025-11-01 13:21:43 +0800
TIMESTAMP: HLS-REPORT: synth get_timing_paths: 2025-11-01 13:21:43 +0800
TIMESTAMP: HLS-REPORT: synth process timing paths: 2025-11-01 13:21:43 +0800
TIMESTAMP: HLS-REPORT: synth get_all_vv_rpt_files: 2025-11-01 13:21:43 +0800
TIMESTAMP: HLS-REPORT: synthesis write_reports_vivado: 2025-11-01 13:21:43 +0800
HLS EXTRACTION: synth area_totals:  0 53200 106400 220 280 0 0
HLS EXTRACTION: synth area_current: 0 4733 6408 14 2 0 64 0 0 0
HLS EXTRACTION: synth resources_dict: AVAIL_LUT 53200 LUT 4733 AVAIL_FF 106400 FF 6408 AVAIL_DSP 220 DSP 14 AVAIL_BRAM 280 BRAM 2 AVAIL_URAM 0 URAM 0 LATCH 0 SRL 64 AVAIL_CLB 0 CLB 0
INFO: HLS-REPORT: generated D:/Xillinx_Project/PROJECT/cholesky_test/kernel_cholesky_0/hls/impl/verilog/report/vivado_syn.xml
INFO: HLS-REPORT: generated D:/Xillinx_Project/PROJECT/cholesky_test/kernel_cholesky_0/hls/impl/report/verilog/kernel_cholesky_0_export.rpt


Implementation tool: Xilinx Vivado v.2024.2
Project:             kernel_cholesky_0
Solution:            hls
Device target:       xc7z020-clg484-1
Report date:         Sat Nov 01 13:21:44 +0800 2025

#=== Post-Synthesis Resource usage ===
SLICE:            0
LUT:           4733
FF:            6408
DSP:             14
BRAM:             2
URAM:             0
LATCH:            0
SRL:             64
CLB:              0

#=== Final timing ===
CP required:                     6.000
CP achieved post-synthesis:      6.171
Timing not met

TIMESTAMP: HLS-REPORT: synthesis end: 2025-11-01 13:21:44 +0800
# if { $has_impl } {
#   # launch run impl
#   if { [llength $impl_props] } {
#     set_property -dict $impl_props [get_runs impl_1]
#   }
#   launch_runs impl_1
#   wait_on_run impl_1
#   # impl reports
#   hls_vivado_reports_impl impl_1 $report_options
# }
# hls_vivado_reports_finalize $report_options
TIMESTAMP: HLS-REPORT: all reports complete: 2025-11-01 13:21:44 +0800
INFO: [Common 17-206] Exiting Vivado at Sat Nov  1 13:21:44 2025...
INFO: [HLS 200-802] Generated output file kernel_cholesky_0/kernel_cholesky_0.zip
INFO: [HLS 200-112] Total CPU user time: 2 seconds. Total CPU system time: 1 seconds. Total elapsed time: 254.051 seconds; peak allocated memory: 331.965 MB.
INFO: [vitis-run 60-791] Total elapsed time: 0h 4m 19s
