

================================================================
== Vitis HLS Report for 'lzCompress_6_4_65536_6_1_1024_64_Pipeline_lz_compress_leftover'
================================================================
* Date:           Fri Oct 31 14:48:57 2025

* Version:        2024.2 (Build 5238294 on Nov  8 2024)
* Project:        lz4CompressEngineRun
* Solution:       hls (Vivado IP Flow Target)
* Product family: zynq
* Target device:  xc7z020-clg484-1


================================================================
== Performance Estimates
================================================================
+ Timing: 
    * Summary: 
    +--------+---------+----------+------------+
    |  Clock |  Target | Estimated| Uncertainty|
    +--------+---------+----------+------------+
    |ap_clk  |  7.00 ns|  4.826 ns|     0.70 ns|
    +--------+---------+----------+------------+

+ Latency: 
    * Summary: 
    +---------+---------+-----------+-----------+-----+-----+------------------------------------------------+
    |  Latency (cycles) |   Latency (absolute)  |  Interval |                    Pipeline                    |
    |   min   |   max   |    min    |    max    | min | max |                      Type                      |
    +---------+---------+-----------+-----------+-----+-----+------------------------------------------------+
    |        7|        7|  49.000 ns|  49.000 ns|    6|    6|  loop auto-rewind stp (delay=0 clock cycles(s))|
    +---------+---------+-----------+-----------+-----+-----+------------------------------------------------+

    + Detail: 
        * Instance: 
        N/A

        * Loop: 
        +------------------------+---------+---------+----------+-----------+-----------+------+----------+
        |                        |  Latency (cycles) | Iteration|  Initiation Interval  | Trip |          |
        |        Loop Name       |   min   |   max   |  Latency |  achieved |   target  | Count| Pipelined|
        +------------------------+---------+---------+----------+-----------+-----------+------+----------+
        |- lz_compress_leftover  |        5|        5|         2|          1|          1|     5|       yes|
        +------------------------+---------+---------+----------+-----------+-----------+------+----------+

============================================================
+ Verbose Summary: Synthesis Manager
============================================================
InlineROM: 1
ExposeGlobal: 0
============================================================
+ Verbose Summary: CDFG Model
============================================================
IsTopModel: 0
ResetActiveHigh: 1
IsCombinational: 0
IsDatapathOnly: 0
HasWiredReturn: 1
HasMFsm: 2
HasVarLatency: 1
IsPipeline: 0
IsRtlPipelined: 0
IsInstanceOverlapped: 0
IsDontTouch: 0
HasImplIP: 0
IsGatedGlobalClock: 0

+ Individual pipeline summary: 
  * Pipeline-0: initiation interval (II) = 1, depth = 2


============================================================
+ Verbose Summary: Schedule
============================================================
* Number of FSM states : 2
* Pipeline : 1
  Pipeline-0 : II = 1, D = 2, States = { 1 2 }
* Dataflow Pipeline: 0

* FSM state transitions: 
1 --> 2 
2 --> 

* FSM state operations: 

State 1 <SV = 0> <Delay = 4.82>
ST_1 : Operation 5 [1/1] (0.00ns)   --->   "%m = alloca i32 1" [D:/Xillinx_Project/PROJECT/data_compression/L1/tests/lz4_compress/../../../L1/include/hw/lz_compress.hpp:205]   --->   Operation 5 'alloca' 'm' <Predicate = true> <Delay = 0.00>
ST_1 : Operation 6 [1/1] (0.00ns)   --->   "%specmemcore_ln0 = specmemcore void @_ssdm_op_SpecMemCore, i32 %compressdStream, i64 666, i64 10, i64 18446744073709551615"   --->   Operation 6 'specmemcore' 'specmemcore_ln0' <Predicate = true> <Delay = 0.00>
ST_1 : Operation 7 [1/1] (0.00ns)   --->   "%specinterface_ln0 = specinterface void @_ssdm_op_SpecInterface, i32 %compressdStream, void @empty_3, i32 0, i32 0, void @empty_4, i32 0, i32 0, void @empty_4, void @empty_4, void @empty_4, i32 0, i32 0, i32 0, i32 0, void @empty_4, void @empty_4, i32 4294967295, i32 0, i32 0"   --->   Operation 7 'specinterface' 'specinterface_ln0' <Predicate = true> <Delay = 0.00>
ST_1 : Operation 8 [1/1] (0.00ns)   --->   "%select_ln82_read = read i8 @_ssdm_op_Read.ap_auto.i8, i8 %select_ln82"   --->   Operation 8 'read' 'select_ln82_read' <Predicate = true> <Delay = 0.00>
ST_1 : Operation 9 [1/1] (0.00ns)   --->   "%select_ln82_1_read = read i8 @_ssdm_op_Read.ap_auto.i8, i8 %select_ln82_1"   --->   Operation 9 'read' 'select_ln82_1_read' <Predicate = true> <Delay = 0.00>
ST_1 : Operation 10 [1/1] (0.00ns)   --->   "%select_ln82_2_read = read i8 @_ssdm_op_Read.ap_auto.i8, i8 %select_ln82_2"   --->   Operation 10 'read' 'select_ln82_2_read' <Predicate = true> <Delay = 0.00>
ST_1 : Operation 11 [1/1] (0.00ns)   --->   "%select_ln82_3_read = read i8 @_ssdm_op_Read.ap_auto.i8, i8 %select_ln82_3"   --->   Operation 11 'read' 'select_ln82_3_read' <Predicate = true> <Delay = 0.00>
ST_1 : Operation 12 [1/1] (0.00ns)   --->   "%select_ln82_4_read = read i8 @_ssdm_op_Read.ap_auto.i8, i8 %select_ln82_4"   --->   Operation 12 'read' 'select_ln82_4_read' <Predicate = true> <Delay = 0.00>
ST_1 : Operation 13 [1/1] (1.58ns)   --->   "%store_ln205 = store i3 1, i3 %m" [D:/Xillinx_Project/PROJECT/data_compression/L1/tests/lz4_compress/../../../L1/include/hw/lz_compress.hpp:205]   --->   Operation 13 'store' 'store_ln205' <Predicate = true> <Delay = 1.58>
ST_1 : Operation 14 [1/1] (0.00ns)   --->   "%br_ln0 = br void %for.inc234"   --->   Operation 14 'br' 'br_ln0' <Predicate = true> <Delay = 0.00>
ST_1 : Operation 15 [1/1] (0.00ns)   --->   "%m_1 = load i3 %m" [D:/Xillinx_Project/PROJECT/data_compression/L1/tests/lz4_compress/../../../L1/include/hw/lz_compress.hpp:205]   --->   Operation 15 'load' 'm_1' <Predicate = true> <Delay = 0.00>
ST_1 : Operation 16 [1/1] (1.65ns)   --->   "%icmp_ln205 = icmp_eq  i3 %m_1, i3 6" [D:/Xillinx_Project/PROJECT/data_compression/L1/tests/lz4_compress/../../../L1/include/hw/lz_compress.hpp:205]   --->   Operation 16 'icmp' 'icmp_ln205' <Predicate = true> <Delay = 1.65> <CoreInst = "Cmp">   --->   Core 9 'Cmp' <Latency = 0> <II = 1> <Delay = 1.65> <FuncUnit> <Opcode : 'seteq' 'setne' 'setle' 'setge' 'setlt' 'setgt'> <InPorts = 2> <OutPorts = 1>
ST_1 : Operation 17 [1/1] (0.00ns)   --->   "%br_ln205 = br i1 %icmp_ln205, void %for.inc234.split, void %for.inc246.preheader.exitStub" [D:/Xillinx_Project/PROJECT/data_compression/L1/tests/lz4_compress/../../../L1/include/hw/lz_compress.hpp:205]   --->   Operation 17 'br' 'br_ln205' <Predicate = true> <Delay = 0.00>
ST_1 : Operation 18 [1/1] (1.94ns)   --->   "%outValue = sparsemux i8 @_ssdm_op_SparseMux.ap_auto.5i8.i8.i3, i3 1, i8 %select_ln82_4_read, i3 2, i8 %select_ln82_3_read, i3 3, i8 %select_ln82_2_read, i3 4, i8 %select_ln82_1_read, i3 5, i8 %select_ln82_read, i8 0, i3 %m_1" [D:/Xillinx_Project/PROJECT/data_compression/L1/tests/lz4_compress/../../../L1/include/hw/lz_compress.hpp:208]   --->   Operation 18 'sparsemux' 'outValue' <Predicate = (!icmp_ln205)> <Delay = 1.94> <CoreInst = "BinarySparseMux_DontCare">   --->   Core 137 'BinarySparseMux_DontCare' <Latency = 0> <II = 1> <Delay = 1.94> <FuncUnit> <Opcode : 'sparsemux'> <InPorts = 2> <OutPorts = 1>
ST_1 : Operation 19 [1/1] (1.65ns)   --->   "%add_ln205 = add i3 %m_1, i3 1" [D:/Xillinx_Project/PROJECT/data_compression/L1/tests/lz4_compress/../../../L1/include/hw/lz_compress.hpp:205]   --->   Operation 19 'add' 'add_ln205' <Predicate = (!icmp_ln205)> <Delay = 1.65> <CoreInst = "Adder">   --->   Core 1 'Adder' <Latency = 0> <II = 1> <Delay = 1.65> <FuncUnit> <Opcode : 'add' 'sub'> <InPorts = 2> <OutPorts = 1>
ST_1 : Operation 20 [1/1] (1.58ns)   --->   "%store_ln205 = store i3 %add_ln205, i3 %m" [D:/Xillinx_Project/PROJECT/data_compression/L1/tests/lz4_compress/../../../L1/include/hw/lz_compress.hpp:205]   --->   Operation 20 'store' 'store_ln205' <Predicate = (!icmp_ln205)> <Delay = 1.58>
ST_1 : Operation 27 [1/1] (1.58ns)   --->   "%ret_ln0 = ret"   --->   Operation 27 'ret' 'ret_ln0' <Predicate = (icmp_ln205)> <Delay = 1.58>

State 2 <SV = 1> <Delay = 3.15>
ST_2 : Operation 21 [1/1] (0.00ns)   --->   "%specpipeline_ln206 = specpipeline void @_ssdm_op_SpecPipeline, i32 4294967295, i32 0, i32 0, i32 0, void @empty_4" [D:/Xillinx_Project/PROJECT/data_compression/L1/tests/lz4_compress/../../../L1/include/hw/lz_compress.hpp:206]   --->   Operation 21 'specpipeline' 'specpipeline_ln206' <Predicate = true> <Delay = 0.00>
ST_2 : Operation 22 [1/1] (0.00ns)   --->   "%speclooptripcount_ln205 = speclooptripcount void @_ssdm_op_SpecLoopTripCount, i64 5, i64 5, i64 5" [D:/Xillinx_Project/PROJECT/data_compression/L1/tests/lz4_compress/../../../L1/include/hw/lz_compress.hpp:205]   --->   Operation 22 'speclooptripcount' 'speclooptripcount_ln205' <Predicate = true> <Delay = 0.00>
ST_2 : Operation 23 [1/1] (0.00ns)   --->   "%specloopname_ln205 = specloopname void @_ssdm_op_SpecLoopName, void @empty" [D:/Xillinx_Project/PROJECT/data_compression/L1/tests/lz4_compress/../../../L1/include/hw/lz_compress.hpp:205]   --->   Operation 23 'specloopname' 'specloopname_ln205' <Predicate = true> <Delay = 0.00>
ST_2 : Operation 24 [1/1] (0.00ns)   --->   "%zext_ln208 = zext i8 %outValue" [D:/Xillinx_Project/PROJECT/data_compression/L1/tests/lz4_compress/../../../L1/include/hw/lz_compress.hpp:208]   --->   Operation 24 'zext' 'zext_ln208' <Predicate = true> <Delay = 0.00>
ST_2 : Operation 25 [1/1] ( I:3.15ns O:3.15ns )   --->   "%write_ln209 = write void @_ssdm_op_Write.ap_fifo.volatile.i32P0A, i32 %compressdStream, i32 %zext_ln208" [D:/Xillinx_Project/PROJECT/data_compression/L1/tests/lz4_compress/../../../L1/include/hw/lz_compress.hpp:209]   --->   Operation 25 'write' 'write_ln209' <Predicate = true> <Delay = 3.15> <CoreInst = "FIFO_SRL">   --->   Core 80 'FIFO_SRL' <Latency = 0> <II = 1> <Delay = 3.54> <Storage> <Opcode : 'read' 'write' 'nbread' 'nbwrite'> <Ports = 0> <Width = 32> <Depth = 8> <FIFO>
ST_2 : Operation 26 [1/1] (0.00ns)   --->   "%br_ln205 = br void %for.inc234" [D:/Xillinx_Project/PROJECT/data_compression/L1/tests/lz4_compress/../../../L1/include/hw/lz_compress.hpp:205]   --->   Operation 26 'br' 'br_ln205' <Predicate = true> <Delay = 0.00>


============================================================
+ Verbose Summary: Timing violations
============================================================
Target clock period: 7.000ns, clock uncertainty: 0.700ns.

 <State 1>: 4.826ns
The critical path consists of the following:
	'store' operation 0 bit ('store_ln205', D:/Xillinx_Project/PROJECT/data_compression/L1/tests/lz4_compress/../../../L1/include/hw/lz_compress.hpp:205) of constant 1 on local variable 'm', D:/Xillinx_Project/PROJECT/data_compression/L1/tests/lz4_compress/../../../L1/include/hw/lz_compress.hpp:205 [15]  (1.588 ns)
	'load' operation 3 bit ('m', D:/Xillinx_Project/PROJECT/data_compression/L1/tests/lz4_compress/../../../L1/include/hw/lz_compress.hpp:205) on local variable 'm', D:/Xillinx_Project/PROJECT/data_compression/L1/tests/lz4_compress/../../../L1/include/hw/lz_compress.hpp:205 [18]  (0.000 ns)
	'add' operation 3 bit ('add_ln205', D:/Xillinx_Project/PROJECT/data_compression/L1/tests/lz4_compress/../../../L1/include/hw/lz_compress.hpp:205) [28]  (1.650 ns)
	'store' operation 0 bit ('store_ln205', D:/Xillinx_Project/PROJECT/data_compression/L1/tests/lz4_compress/../../../L1/include/hw/lz_compress.hpp:205) of variable 'add_ln205', D:/Xillinx_Project/PROJECT/data_compression/L1/tests/lz4_compress/../../../L1/include/hw/lz_compress.hpp:205 on local variable 'm', D:/Xillinx_Project/PROJECT/data_compression/L1/tests/lz4_compress/../../../L1/include/hw/lz_compress.hpp:205 [29]  (1.588 ns)

 <State 2>: 3.150ns
The critical path consists of the following:
	fifo write operation ('write_ln209', D:/Xillinx_Project/PROJECT/data_compression/L1/tests/lz4_compress/../../../L1/include/hw/lz_compress.hpp:209) on port 'compressdStream' (D:/Xillinx_Project/PROJECT/data_compression/L1/tests/lz4_compress/../../../L1/include/hw/lz_compress.hpp:209) [27]  (3.150 ns)


============================================================
+ Verbose Summary: Binding
============================================================
N/A
* FSMD analyzer results:
  - Output states:
 - Input state : 
  - Chain level:
	State 1
	State 2


============================================================
+ Verbose Summary: Datapath Resource usage 
============================================================
N/A
